comment,stars,verified,date,country,helpful,has-media
Universal remote won't work on my cable box.,3,1,2020-7-28,1,0,0
Perfect for watching movies. Everything you would expect from Bose.,5,1,2020-5-13,1,0,0
good deal,5,1,2019-6-27,1,0,0
Sounds amazing and easily hooks up via Bluetooth for all devices.,5,1,2020-7-10,1,0,0
"My sound is so much better, don't have to increase or lower my sound. It stays consistent.",5,1,2019-5-29,1,0,0
Great sound,5,1,2019-3-29,1,0,0
Excellent Sound Bar. Wont be disappointed!  Clean crisp sound. Deep base. Bose is the best as always. Great for playing music too.,5,1,2020-4-19,1,0,0
Smaller than I thought not quite as loud as it should be.  Quick easy set up easy to use.,5,1,2019-7-18,1,0,0
I was expecting more bass. Was expecting more of a surround system sound.,5,1,2020-7-29,1,0,0
Nice sound,5,1,2017-2-18,1,1,0
Great sound and good product. I rate it 4 stars because it wasn't Bose Solo 5 but a Bose Solo with the small remote,4,1,2018-4-30,1,0,0
"Muy bajo el volumen , se oye mas mi spek3rde 20watts",1,1,2019-6-30,1,1,0
Perfect for what we needed it for !!,5,1,2019-1-4,1,0,0
Awesome.  Works great,5,1,2018-7-8,1,0,0
you can really tell the difference love the system awesome low price,5,1,2018-3-18,1,0,0
"sound from TV much improved, especially for music",5,1,2019-12-15,1,0,0
Not as easy to connect as we had hoped but we got it together. Love watching movies at home  now!!!,5,1,2019-1-1,1,0,0
Bose is the only word I need to say.,5,1,2019-6-20,1,0,0
Bass obviously lacks a little but I'm very happy with what I got for what I paid.,5,1,2020-2-18,1,0,0
Nice full sound but i like a little more rumble on some movies.  And I would've like it better too if it also came with rear speakers.,3,1,2018-4-27,1,0,0
I highly recommend this product I  give 4 stars because of size the controller it's to big !!!,4,1,2019-9-16,1,0,0
Terrible product for the money! I feel like your just buying the name here.,1,1,2020-8-11,1,0,1
Sounds very good.  Easy to set up,5,1,2020-5-20,1,0,0
Great value for money,5,1,2019-10-19,1,0,0
unable to use only one remote need one for tv and one for sound bar,5,1,2019-10-10,1,0,0
"We love it, added great sound to televison.",5,1,2020-7-10,1,0,0
I love it!,4,1,2020-4-5,1,0,0
"Great Product - Sound is fantastic, but the Optical Cable and Optical Cable insert are not very good. They do not hinge together well.",4,1,2018-12-30,1,0,0
Makes the sound clear without turning it up so loud,5,1,2017-9-17,1,0,0
"does decent job of cleaning up soundtrack, although nothing will help the determined brit actor whois mumbling his/her lines and swallowing sentence endings.",4,1,2018-6-5,1,0,0
"Love the sound, great value!",5,1,2018-12-24,1,0,0
The sound quality is not very good. It’s not very loud and not very clear. I wouldn’t recommend or purchase again.,1,1,2020-7-31,1,0,0
Difficult to program the remote control  no on and off buttons on the soundbar,3,1,2020-5-8,1,0,0
"Love it, use it for our entertainment system as well as Bluetooth to play music through our phones.",5,1,2018-7-17,1,0,0
We love our new Bose soundbar. It made such a huge difference in our at home movie nights.,5,1,2017-1-21,1,1,0
Excelente,5,1,2019-8-26,1,0,0
Great sound,5,1,2019-9-22,1,0,0
Easy to install with a excellent sound,5,1,2018-5-26,1,0,0
Super easy to install and sounds great!,5,1,2020-9-8,1,0,0
Very nice sound improvement.,5,1,2018-1-8,1,0,0
"Good price, easy to install and operate, great sound quality addition to my home system. Fast delivery. No problems!",5,1,2020-1-4,1,0,0
"Great, the only thing o would suggest purchase on with the HDMI cable then you can use your tv remote",5,1,2020-5-12,1,0,0
This sound bar was extremely easy to install and sounds great,5,1,2016-12-30,1,0,0
So far I am in love this is one of the best speakers I have bought in awhile I am very proud of Amazon on this purchase thank you,5,1,2019-9-29,1,0,0
Used this a maximum of 8 times. Now it won't even turn on. Bad product!!,1,1,2020-7-18,1,0,0
"Hey, what can I say, it's a BOSE. Superior product for the price.",5,1,2018-4-23,1,0,0
Works great right out of the box. So easy to set up. Love the sound. Bose is the best!,5,1,2017-8-1,1,0,0
"poor sound, awful remotereturned it a bought Samsung which worked out very well.",3,1,2019-6-27,1,0,0
The description says HDMI arc is a feature. This is a lie.,1,1,2020-4-6,1,0,0
Great sound. Good U/I.,5,1,2018-6-25,1,1,0
"Easy to install, works well. Sounds good but doesn't pump out to much volume, needs a subwoofer",4,1,2018-4-25,1,0,0
"remote bulky,not able to connect to tv",5,1,2019-6-6,1,0,0
quality sound and ease of control.  The multiple device control works well as well as the Bluetooth.,5,1,2018-12-8,1,0,0
This BOSE SOUND BAR really made my big screen tv WONDERFUL!!! I’m VERY PLEASED WITH MYPURCHASE!!!,5,1,2020-8-29,1,0,0
Great sound,5,1,2020-1-25,1,0,0
To enhance the quality of sound from my television,2,1,2019-6-20,1,0,0
"Great sound at a great price, also small and sleek design, can’t beat it.",5,1,2020-6-17,1,0,0
This devise has made our television viewing much more pleasurable,5,1,2019-8-28,1,0,0
Sounded great. Lasted about 18 months and literally just died. No hdmi arc. Will not buy again.,2,1,2019-5-11,1,0,0
Grat,5,1,2019-1-8,1,0,0
Off the hook sound for a sandbar!! BOSE always does it right.,5,1,2019-1-30,1,0,0
Having issues with quality,3,1,2019-7-3,1,0,0
Good Quality like all Bose!,4,1,2018-3-15,1,0,0
Love the ease of installation and setup to enable the customer to get the best sound quality for their own experience.,5,1,2019-10-12,1,0,0
Love it!,5,1,2020-1-18,1,0,0
A great  sound bar  !! Easy to hook up !,5,1,2020-5-14,1,0,0
"So far so good. Had a previous version of the Bose Solo which only lasted about 18 months, and would ""drop out"" occasionly. This new version is working fine,so far. Time will tell I guess!!",5,1,2018-1-11,1,0,0
good,5,1,2020-4-19,1,0,0
i love it nice sound just great,5,1,2017-8-7,1,0,0
Awesome sound,5,1,2019-1-21,1,0,0
Like quality of product and sound of product. Returning one that I ordered by mistake don't need two.Thanks for a quality product.,5,1,2020-1-14,1,0,0
Kinda of small but it sounds good.,5,1,2020-7-21,1,0,1
Easy hook up and talking is clearer,5,1,2019-8-13,1,0,0
used it in hope of boosting TV sound quality.it makes very little difference in regular mode or conversation mode.,3,1,2019-12-17,1,0,0
Thought it would sound like a Bose,2,1,2020-9-3,1,0,0
"Compact, easy to install. Comes with a universal remote that syncs easily with all other components",4,1,2020-3-2,1,0,0
This unit makes tv much easier to hear with my hearing aid.,5,1,2017-9-3,1,0,0
Got this for my mom who was having trouble hearing dialogue in movies. She loves it.,5,1,2018-1-13,1,0,0
We have an older TV with a stand on a surface that made all other sound bar and stands impossible due to dimensions. The Bose is small enough to fit between the feet of the stand. Disappointed at first with audio quality but it turned out to be a problem with trying to pass through the audio via the TV. Running the signal directly from the TiVo Mini to the Bose fixed it. I suspect it's an issue with the older TV and not the Bose.,5,1,2016-8-6,1,1,0
Great sound for this little soundbar,5,1,2020-2-4,1,0,1
"I love my Bose. It fits perfectly in front of my 60"" Samsung tv. Great sound in our great room.",5,1,2019-10-11,1,0,0
Only downfall of this sound bar is that there’s only an optical input/output so you don’t see the volume level on your tv.,5,1,2018-12-7,1,0,0
Great sound in a small affordable unit.,5,1,2019-7-19,1,0,0
Excellent product that has excellent sound and was easy to install.,5,1,2020-1-27,1,0,0
"Muy buen producto, recomendado",5,1,2019-7-24,1,0,0
very low sound volume and no HDMI cable.,2,1,2019-9-23,1,0,0
I really don’t know about sound but I enjoy it and I can use it with Bluetooth to play music from my phone.,5,1,2020-1-18,1,0,0
Just OK,3,1,2019-8-30,1,0,0
"Sounds amazing,,, and not intrusive at all!! Fits perfectly,, just Love the Bose sound Bar!!",5,1,2018-10-9,1,1,0
This sounds great. you can hear the difference and the bluetooth is great for listening to music or podcasts,5,1,2018-6-7,1,0,0
Terrible Sound,1,1,2019-7-31,1,1,0
I love the sound quality!,5,1,2019-3-22,1,0,0
"The sound is nice, though the base is just a smidge lower than I expected. Though still nice enough. If you want an uncomplicated sound system, I'd buy this again.",4,1,2018-4-7,1,0,0
Smaller size than most which I love. Sleek black look and the sound is great!,5,1,2020-3-4,1,0,0
Great,5,1,2020-1-27,1,0,0
"Goes well with my new TV & completes my ""home theater"".",5,1,2017-1-13,1,1,0
as expected!,5,1,2017-12-26,1,0,0
Can now understand dialogue in programs over background music and noise,5,1,2020-2-25,1,0,0
The speakers sounded crisp but there is no bass.,1,1,2018-3-1,1,2,0
Awesome speaker! Top notch quality sound for the price!.,5,1,2017-1-20,1,1,0
No vale la pena la calidad del sonido es buena pero no mejora mucho el volumen máximo del televisor original. No la recomiendo,2,1,2020-1-14,1,0,0
"TV speakers sound good as compared to this speaker! Not worth the money, samsung/jbl have better soundbar in this price range",1,1,2020-8-26,1,0,0
I love the great sound. Music sounds clear.,5,1,2020-1-8,1,0,0
"great sound, universal remote is great. I would recommend this if you're looking for big sound from a small sound bar.",5,1,2017-10-8,1,0,0
It doesn’t turn up loud for tv and should have a volume indicator to show what level. It’s ok for music.,3,1,2020-8-3,1,0,0
My first ever soundbar! The remote is huge but it's worth it. You can program it anyway you'd like and the sound is amazing! IMAX sound quality 👌,5,1,2020-5-24,1,0,0
"Sound quality is good, but not loud enough",3,1,2019-2-2,1,0,0
Nice system. High quality. Easy to mount,5,1,2020-3-1,1,0,0
"It works good for the price, However I did have to buy a new TV to be able to use the optical",4,1,2020-7-6,1,0,1
I found it relatively easy to set up and sync with all my devices. great product for the money,4,1,2020-8-30,1,0,0
"Very good sound. Simple to install. It has a dialogue feature but I find the sound so good that I don't need to use it (and I watch a lot of hard to hear British programs). Compact, easy to place in a convenient spot, light. Bluetooth too so can use either phone/iPad for music. Overall for the price I am very satisfied.",4,1,2016-9-23,1,6,0
Met all expectations. Great sound from such a small item. Better than my five speaker  lg surround sound system. Very easy to install. Only one wire needed. Purchased  two more for living room and den. Very satisfied,5,1,2016-7-16,1,7,0
"The sound quality it's good, however I would expected something better and the remote control is too big and heavy. Bose doesn't surprise me this time.",3,1,2017-9-18,1,0,0
It stopped working after one year.,1,1,2019-8-27,1,1,0
The sound quality was not loud at all. Bose products are usually awesome but this was so disappointing.,2,1,2018-9-8,1,0,0
Wonderful sound,5,1,2019-2-3,1,0,0
It’s a decent soundbar but not what I expect from Bose. It’s really only marginally better than my Samsung tv speakers.,3,1,2020-1-7,1,0,0
"Unfortunately I am not very impressed by the quality of the sound bar. I expected crisper, sharper and better sound. Disappointed.",1,1,2020-7-18,1,0,0
"Easy to install, good quality sound. That is Bose.",5,1,2020-5-1,1,0,0
"Totally satisfactory. Really helped the hearing problem, especially the Dialog feature.",4,1,2016-5-26,1,1,0
Pretty good for its size.,5,1,2020-2-22,1,0,0
"I recently got my bose solo 5 and for what it's worth, I absolutely love it. It fills my room with clarity. It has some base too.",5,1,2020-7-20,1,0,0
"Bought used, super easy to set up, good range and nice( but not great) bass.",4,1,2020-1-11,1,0,0
"Sounds great, is all the time while cleaning.",5,1,2019-7-26,1,0,0
Good product quality and value!!!!!,5,1,2020-7-12,1,0,0
Much better sound than TV speakers alone.  Clarity is excellent.,5,1,2018-9-29,1,0,0
Brilliant,5,1,2016-5-31,1,2,0
Excellent product...as I would expect from Bose!,5,1,2020-2-3,1,0,0
Wasn't impressed by the sound. Expected alot better from BOSE,2,1,2020-2-1,1,0,0
Definate improvement and clear sound but no substitute for surround sound.,3,1,2017-4-3,1,1,0
The sound bar is everything we hoped it would be.,5,1,2020-6-26,1,0,0
It cranks,5,1,2020-7-23,1,0,0
The ease to program to all devices,4,1,2019-8-30,1,0,0
good value,5,1,2020-3-25,1,0,0
I've had bose before and im very disappointed with the sound,2,1,2020-7-2,1,0,1
Absolutely Awesome,5,1,2018-6-4,1,0,0
"Amazing sound, easy set up",5,1,2020-1-21,1,0,0
every thing is working for now manuel missing,4,1,2019-5-12,1,0,0
"The sound reproduction is flat and mushy sounding, for the price I paid i can get a better quality, surprised that Bose would produce such a marginal sounding sound bar????",2,1,2017-10-11,1,0,0
Mine just stopped working after 18 months. I loved the speaker but the longevity wasn’t worth it.,2,1,2020-7-15,1,0,0
I like the sound it puts out. There is a crisp clear speaker which separates the voices from the background music.,5,1,2019-12-31,1,0,0
Great sound quality for the money and easy to switch from TV or cable to Bluetooth.  Bose has never let me down...,5,1,2019-9-8,1,0,0
"Price was a bit more than I wanted to spend.....Bose is always more pricey, worth the price. Was very easy to install,  works perfectly. Very satisfied.",5,1,2016-12-26,1,0,0
The sound is amazing,5,1,2020-3-6,1,0,0
Simple setup and easy installation.  Great sound for the money.,5,1,2020-6-6,1,0,0
"I'm no audiophile and I don't need pristine sound. With that being said, this soundbar does everything I need. Setup is super easy and the sound is great.  The remote works for my TV and for my satellite, DirectV. I'm very satisfied.",5,1,2017-1-5,1,0,0
"Man you really can’t beat this deal, the good bass and crisp sound have me enjoying my favorite movies and music even more. Must buy",5,1,2020-5-27,1,0,0
After 7 months it stopped working...,1,1,2019-7-12,1,1,0
Will not work with cable. ICox.,1,1,2019-6-11,1,1,0
"Awesome sound, love the enhanced dialog button for watching movies",5,1,2020-1-9,1,0,0
Makes the sound much clearer and crisp.,5,1,2020-3-9,1,0,0
Ease of set up,5,1,2019-11-26,1,0,0
Great sound and it the perfect size for motorhome usage.,4,1,2017-9-19,1,0,0
Very good product I like!☺,5,1,2020-8-18,1,0,0
"Great quality, good construction, super technology, easy to install and use.",5,1,2020-7-14,1,0,0
excellent,5,1,2017-10-8,1,0,0
Bought this for my wife she loves it,5,1,2018-12-11,1,0,0
Awesome sound,5,1,2019-6-18,1,0,0
Good product,5,1,2019-8-5,1,0,0
Works great for those tvs that are hard to hear because the speakers are so small.,4,1,2019-2-8,1,0,0
terrific sound  just what I was looking for,5,1,2017-8-29,1,1,0
"Small, easy to install and use. Problem is that the TCL tv is not compatible with the universal remote by Bose",4,1,2019-7-8,1,0,0
The small footprint works well for the TV that we are using it on.,5,1,2018-6-30,1,0,0
This soundbar is fair to midland at best.,2,1,2020-9-9,1,0,0
You can’t go wrong with the sound from this bar! Super easy to setup and use! I will be getting another one for my RV.,5,1,2020-8-2,1,0,0
Great sound. A bit on expensive side but well worth it,5,1,2019-5-23,1,0,0
Great soundbar.....completely changed the volume on my very expensive Samsung curved screen tv.,5,1,2019-9-7,1,0,0
Very nice sound it’s a Bose very good quality sound,1,1,2019-8-18,1,0,0
I love this. We had an older version and it finally went. This is the replacement and couldn’t be happier!,5,1,2019-9-4,1,0,0
I wouldn't recommend this product the cost is way too expensive!,2,1,2020-9-5,1,0,0
For the quality of sound for the price very good.,5,1,2019-8-11,1,0,0
"Makes a good tv speaker, not so much for music. Will not blow your ears out.",3,1,2020-1-5,1,0,0
This system delivers great sound and in a very compact design.,5,1,2019-12-10,1,0,0
Love it!!!,5,1,2020-1-13,1,0,0
It helps with the clarity of the tv sound,5,1,2020-6-5,1,0,0
Works and sounds great,5,1,2020-1-5,1,0,0
The quality of the sound is not what I expected,3,1,2020-2-26,1,0,0
"Love this, but we can't use our standard remote to control sound.",5,1,2018-11-16,1,0,0
I like the size price and quality,5,1,2020-1-13,1,0,0
Sounds great.  Could not program remote to older model TV.,5,1,2019-1-24,1,0,0
Husband loves it.  He can now watch movies as if he were in a theater.,5,1,2018-7-13,1,0,0
"Disappointed, I was expecting quality sound but didn't get it. Money not well spent, should've return it. Don't waste your money, buy the next model this model only has two speakers nothing fancy too expensive for what you get.",1,1,2017-8-9,1,8,0
Love it,5,1,2019-12-10,1,0,0
Easy to install and operate.  Love the full sized universal remote,5,1,2019-3-10,1,0,0
No one can beat Bose..this is the best speakers i have,5,1,2016-5-24,1,1,0
The sound is awesome!,5,1,2018-4-10,1,0,0
Maximum volume is not very loud to other soundbars. Not very good and not what I expect from Bose.,2,1,2020-6-29,1,0,0
Absolutely love the sound quality great price also,5,1,2018-12-10,1,0,0
This unit simply doesn’t produce the volume levels required for a mid sized room. Disappointed,2,1,2020-4-18,1,0,0
It is easy to use with great quality.,5,1,2019-2-27,1,0,0
Doesn't sound like a bose.,2,1,2020-7-23,1,0,0
"It is an amazing sound for it's size, especially the bass which is adjustable - the 3 different input option are very helpful",5,1,2018-4-10,1,0,0
It has a clean sound all i am missing is the subwoofer. Great sound and most importantly my wife approved.,5,1,2020-7-23,1,0,0
Well spent money!!!!,5,1,2019-7-26,1,0,0
stopped working altogether a month after the 1-year warranty expired. total waste of money.,1,1,2018-2-12,1,1,0
"El producto arribo rapido, le experiencia de compra fur excelente",5,1,2020-7-12,1,0,0
Not that great,2,1,2018-12-13,1,0,0
"At first I was some what skeptical, but once we got acclimated it’s actually a good sounding piece of sound equipment for the price. Once again, Bose done good.",4,1,2018-3-4,1,0,0
Replaced a vizio soundbar.  Night and day difference.  No more lip sync issues!,5,1,2020-3-24,1,0,0
Something jammed in output receptacle .  Unusable.  Not refurbished.  Don't waste your money.,1,1,2020-9-17,1,0,0
The product came with all of the connection cables contrary to what was recommended for addl purchase.,5,1,2018-10-30,1,0,0
This product came in dented in the front.  I am returning this although it works fine.,2,1,2018-9-7,1,0,0
"Great value, good quality! I would recommend it to anyone who wanted to upgrade their sound.",5,1,2020-5-14,1,0,0
after a week of use the sound stopped completely and now I have to seek technical assistance,3,1,2018-12-30,1,0,0
My what a difference this makes with my new flat screen 75 inch television. Love it.,5,1,2018-5-17,1,0,0
"Works amazing for our living area. Small package, mighty sound. We use it with our 55"" LG and it is very impressive. The auto on feature is a life saver.",5,1,2017-5-6,1,7,1
"Bad quality sound. Did not receive the hook ups. Said it was delieverd, it was not",1,1,2018-9-25,1,1,0
"Big Sound in a Small package, balling on a budget!",5,1,2020-1-10,1,0,0
We like it a lot! Can’t figure out how to get the remote to work with our Cox cable box though..,5,1,2019-2-19,1,0,0
Like the exterior. The size of it comes perfect. One thing I don't like is it doesn't support BOSE Connect APP,5,1,2017-11-17,1,0,0
Bose quality sound.,5,1,2018-2-27,1,0,0
"We have an open floor plan and the noise gets lost in the room. I'm sure it would be good in a smaller room. It doesn't put out enough sound or get loud enough, I was disappointed in Bose.",2,1,2017-1-9,1,6,0
Sound quality isn’t what I am used to out of Bose,2,1,2020-1-18,1,0,0
"Sounds great, easy to integrate. What's not to like?",5,1,2018-2-11,1,0,0
For once a sound bar that delivers on dialogue. Best Buy Ever.,5,1,2020-8-14,1,0,0
This is a superb system and priced competitively,5,1,2020-1-29,1,0,0
I was so disappointed with this. I love Bose but it didn’t match up for the price it was.,1,1,2020-5-18,1,0,0
1like it,5,1,2020-9-11,1,0,0
Well worth the money,5,1,2020-2-4,1,0,0
perfect,5,1,2020-4-17,1,0,0
Easy to install. Great sound,5,1,2020-8-3,1,0,0
The sound is amazing. Enough bass control for most folks,5,1,2020-7-16,1,0,0
I was very  happy  with my choice  and my husband  loves it,5,1,2020-1-8,1,0,0
The only problem that this item has that it don't have a manual turn on and off button.,5,1,2018-12-20,1,0,0
"Like all products from Bose, it has great quality and sound",5,1,2020-7-22,1,0,0
Sounds great,5,1,2016-7-6,1,1,0
nothing negative to share......,5,1,2020-3-14,1,0,0
"fully met the expectations, very easy to use",5,1,2019-4-22,1,0,0
Great sound from a small piece of equipment.,5,1,2019-10-17,1,0,0
Buena calidad y excelente producto.,5,1,2020-6-11,1,0,0
After 6 months of OK performance it died never producing another sound.,1,1,2020-9-14,1,0,0
such amazing sound from such a compact unit,5,1,2019-1-15,1,0,0
I expected more for the money and from Bose.Sound quality not as expected. I returned it.,3,1,2020-7-19,1,0,0
Universal remote not comparable Sony TV.,4,1,2020-7-12,1,0,0
The Bose has made it TV watching enjoyable again. Wish I would have done it sooner.,5,1,2018-12-15,1,0,0
My husband couldn't really hear the television speakers clearly.Awesome sound,5,1,2020-1-26,1,0,0
Sounds awesome!,5,1,2018-12-26,1,0,0
"I wanted a soundbar for my tv and had purchased another brand with no discernable difference in the sound quality.  I purchased the Bose Solo 5 TV Sound System and my prayers were answered.  Small and compact, the solid sound quality was exactly what I was searching for.  The setup could not be easier and contrary to another review, you do NOT need to purchase anything else to connect the soundbar to a smart tv.  I live in an apartment and the sound is full and rich and the volume will go much louder if I wanted to entertain my neighbors. I am thoroughly happy with my purchase and with Bose name, I am assured it will last.",5,1,2016-6-28,1,1,0
Easy to set up and great sound!!,5,1,2020-1-5,1,0,0
Awesome sound quality delivered from a small compact footprint !  Bose ... knows!!,5,1,2019-8-12,1,0,0
Sound quality is awesome!!,5,1,2020-9-11,1,0,0
High quality & ease of use. Thank you!,5,1,2018-11-11,1,0,0
"Controller to difficult and to many keys,all I want is on/off and sound controll",2,1,2019-7-20,1,0,0
I have a small living room and it worked perfectly !,5,1,2019-7-5,1,0,0
Sounds great,5,1,2020-3-20,1,0,0
Much better sound than the TV speakers,5,1,2019-12-17,1,0,0
Great sound and Addition to bedroom TV,5,1,2019-10-23,1,0,0
"Crap, crap, crap. Not loud enough and stoped working 40 days after. So now I can't even return it.",1,1,2020-6-7,1,0,0
Love this sound bar! It really does the trick and works great for my apartment.,5,1,2020-8-31,1,0,0
Not as loud as the tv but sound quality is goodIt could use more volume,3,1,2020-2-8,1,0,0
Overall good for price,5,1,2020-2-25,1,0,0
"Not too loud, not too soft, just right what you need it to be!",5,1,2019-12-13,1,0,0
My daughter loved it!,5,1,2019-12-23,1,0,0
I  finally received the item late 4/29/20,4,1,2020-4-30,1,0,0
Happy with purchase....great value,4,1,2020-2-25,1,0,0
Great product for the price. Bose did it again!,5,1,2020-2-2,1,0,0
Much easier to understand dialogue on the tv,5,1,2020-7-15,1,0,0
Great sound as always from Bose.  Easy to use and readily pairs to all my devices,5,1,2019-7-31,1,0,1
"Bought this for my husband for Christmas, he loves it!",5,1,2020-1-21,1,0,0
Sweet product good price!,5,1,2019-7-12,1,0,0
Love listening to this sound system.,5,1,2018-1-20,1,0,0
Sound is crisp and clear ... just like you would expect from Bose.,4,1,2020-6-30,1,0,0
Easy to setup and the universal remote was easy too.,5,1,2020-3-3,1,0,0
"Sounds better than tv speakers, even  better not in dialogue mode.",4,1,2019-12-24,1,0,0
Love the sound for the size. Reasonably priced. Own 2 of them now!,5,1,2019-5-6,1,0,0
Not what I thought. I heard it in the store and it sounded louder.,1,1,2020-2-28,1,0,0
Couldn’t be happier with this product.,5,1,2018-12-10,1,0,0
Nice,5,1,2019-12-13,1,0,0
Great sound from small profile,5,1,2019-8-16,1,0,0
There’s not much to say but the sound bar didn’t provide any more sound then the tv. Very disappointed.,1,1,2018-5-24,1,0,0
You can't go wrong with this brand....very thankful I have it now. And also so happy with the Bluetooth  mini speaker too..it works well in the the as well outside the house..up to 30 feet  away..😎☺,5,1,2017-6-5,1,0,0
Compact with excellent sound,5,1,2019-5-23,1,0,0
Easy setup. Great sound works great with my LG TV,5,1,2019-6-18,1,0,0
Died after 26 months. Replacing with a different brand.,2,1,2019-12-11,1,0,0
It works great hook up easy!  Sound is great hooks up to phone easily,4,1,2020-2-20,1,0,0
Sounds great- easy to install,5,1,2017-2-12,1,0,0
"I bought this item because it isn't as wide as most (it had to fit in a tight space) & has a built in woofer.  I have a few other Bose sound systems & they all work perfectly.The only complaint is there isn't a ""learning mode"" where you can setup the CATV remote to drive the TV, STB & the sound bar.  I have a Yamaha sound bar on another TV & it works seamlessly almost all the time.  In order to use this unit, I have to use the Bose supplied remote, which is different from the STB remotes on all my other TV's.  Additionally, the remote doesn't turn on/off all three devices all the time.  It might be a line-of-sight issue to be honest.",4,1,2018-1-24,1,0,0
