comment,stars,verified,date,country,helpful,has-media
"The first one we ordered was great until it completely stopped working.  I sent it back and ordered another one as a replacement because it has such great sound and For goodness sake, it’s a Bose!  The 2nd one has been great (fingers crossed) - so far.  The sound is outstanding for such an inexpensive sound bar.",5,1,2020-9-3,1,0,0
"Good inexpensive answer to improve built in tv speakers.  It does improve the clarity of dialogue in a lot of programs and improves the audio overall. I'm sure you can get better sound from an expensive soundbar, but for the price I'm happy.  Easy to set up. Nice remote.",5,1,2020-1-3,1,1,0
We were looking for a sound bar with better voice clarity. The background music in our other bar made it almost impossible to hear voices. This Bose is far better. We have been very happy with it.The 4 star rating has nothing to do with sound. There are a couple of little things that make the remote less than perfect. It is still as good as most though.,4,1,2019-10-15,1,0,0
"This is the second sound bar that I have purchased. This by far, is the best sound bar for the money, and the fact that it is a Bose speaks volumes. Great purchase!!",5,1,2020-8-9,1,1,0
"I decided to pull the trigger and purchase this soundbar after thinking about it for months. I went from a $60 soundbar to this incredible device and its a night and day upgrade! I use this to listen to music, watch shows, AND play video games and this soundbar manages to keep me immersed throughout all of it! The dialogue mode sounded like a feature that would be gimmicky but once you try it you can never go back!",5,1,2020-3-17,1,0,0
"The sound is excellent.  It is more compact than my last soundbar, giving me more mantle space.  The universal remote works with all my devices.  Okay, one note: I purchased it for a family member, and the universal code for a TCL Roku did not work (these are odd ducks), but a quick Google found the proper code.",5,1,2019-4-8,1,0,0
"It stopped working after 4 months. I sent into Bose for repairs twice and it came back still not working after claiming to have “fixed” it. They provided a new power pack that’s completely different than the original except the new power pack doesn’t come with the prongs to connect into the wall, missing that piece. I’ll never buy Bose again.",1,1,2019-10-11,1,2,0
What I like about this speaker is there is no wire needed to connect it to a television. My tv connects via Bluetooth and the sound quality is really good.,5,1,2019-12-25,1,2,0
The sound isn't really better than the speakers in the flat screen tv.The speaker is not blueray as advertised. The remote is some how a blueray device.,1,1,2019-10-9,1,1,0
Superior sound quality.  The universal remote truly has done every feature (except eject bluray) on all my devices so far.  If there is an eject I haven't discovered it yet but it's only been a coupe days.  It works best to turn your TV volume down to 0 and let this bar do it all.It DOES come with a Toslink cable so you don't need to buy the combo that it is showing you.,5,1,2020-5-28,1,0,0
"Only had this speaker for a little over a year and it no longer works. For such an expensive speaker and the 'Bose' name brand I was expecting many years out of a dependable product. When it worked it was great, but I have changed out battery's - and turned it off. VERY disappointed.",1,1,2017-8-6,1,1,0
"You can buy as good a quality for 1/3rd the price.  Sound is OK, especially with the voice button, but not that much better than a set of cheap speakers.  I bought because of the name.  I won't do that again.",1,1,2019-8-14,1,1,0
"I would just like to confirm that the Echo Dot and Alexa CAN play through the Bose 5 sound system.  Some reviewers have said it can and others have said it can't.  I received my Bose 5 yesterday and checked it out today.  Much better sound than the t.v. speakers, and Alexa also sounds much better when talking or playing music!Getting Alexa to pair with this system is very easy.  I also use the Bose remote for my cable box, t.v. and Panasonic Blu-Ray player.",4,1,2018-1-21,1,7,0
"Not bad if you just want to enhance voice,  overall sound is fair but is way over priced for what it delivers, by atleast $100.  Sound is flat and it really needs a tweeter and treble control to give it a crisp sound.  I expected more from Bose.  You can get far more from a cheaper Yamaha.  Disappointing,  it just need a little more to make it worth the price.",3,1,2019-1-24,1,2,0
"I've been a Bose owner for 20 years and their products never disappoint, until now.  I purchased the Bose Solo 5 to compliment my LG Smart TV and I was very disappointed in the overall quality of sound, not to mention the remote was not compatible with my LG apps.  The remote would pair with my TV, however, I would need to use my other remote to access my apps.  After emailing Bose and following the setup steps again, along with searching for additional codes, it was determined the remote and the LG TV were not compatible.  If the sound would have been better than my TV, then I would have been fine with 2 remotes, but that's not the case.",2,1,2019-9-2,1,0,0
"Was hesitant to purchase with the price being higher than others in the same range of size, but honestly can’t believe the amount of sound quality and room filling ability. Was hesitant at first, but 100% happy with the purchase. Just don’t lose the remote as there are no other ways to control it. The remote that comes with does a great job of replacing other remotes you may have laying on your coffee table. Big plus!",5,1,2020-6-11,1,1,0
"I like the package- but to be honest, until I get a way of getting audio out of my TV i cannot use it.  My TV has one output, funky fiber out, which does not work with HDMI connections of any kind.  So for know I am unable to use it.  I plan on getting a new TV that has a well defined audio out and put it to use.",3,1,2020-1-29,1,0,0
"I found the range of volume was not acceptable.  On at least 1 DVD and 1 streaming program I could barely hear.  As well, one of the national broadcast stations always sounded too soft even when I put volume as high as possible.  My older Sony TV  has much better range of volume as well as better clarity of sound.  One reason I bought the Bose was a button that lowers base to make speech sound more clear.  I used that button every  time but the difference in clarity was only somewhat better.  This Bose  does not have crisp, clear sound nor loud enough volume.  I'm 78 years old so my hearing may not be as sharp as a younger person's.",2,1,2020-8-25,1,0,0
I ordered this based on the sound quality of other Bose speakers we own.  I would probably be happy with the sound quality but I compared new and old side by side.  However it does sound better than the TV’s speakers.  I would rather have a HDMI speaker that automatically coms on/off when the TV is powered on.,4,1,2020-4-14,1,0,0
"Started a home theater. Not the dream by any means but it’s a good start. I love movies. I love shows. I love dialogue and stories. The hardest thing about sound systems is they are not balanced. Many times music can drown out dialogue. This speaker has figured out how to keep the clarity, the sharpness, and just basic dialogue heard. It’s not the surround sound of a movie theater at all. It’s not gonna blow you away if you are expecting to shake the roof off your house. BUT it is a great sound system. It’s balanced and very nice. It’s a great start. I will eventually upgrade but spending the extra $50-75 to get this one versus an LG or other brand is worth it.",4,1,2020-9-15,1,0,0
"Not only is the sound great, but it was very easy to install.  We just hooked it into our tv and it worked like a charm.  We knew we could get better sound with a surround sound system, but since my husband's hearing is not that great, we went with the less expensive Bose.  I'm glad I finally made the purchase.",5,1,2019-9-28,1,0,0
"I recently upgraded the cheap TV in our motorhome, and decided to add a sound bar at the same time.  The sound bar is nice, but really doesn't sound much better than the new Samsung TV I installed.  I do like the compact size of the soundbar, and it works well as a Bluetooth speaker for music from my cell phone.",4,1,2020-8-30,1,0,0
"Great sound bar, just not for a tv. This is perfect for Bluetooth use from your phone or computer. It doesn’t have enough bottom or bass to be used with a tv for those of us who like the full surround sound experience when watching a good movie. Go ahead and spend an extra $100-$150 for a better quality sound.",3,1,2020-6-9,1,2,0
"Love it love it love it! Super sound from old DVDs to new ones. Compact size, super easy to put together. My only negative is the ""universal"" remote control. Gave up trying to add my ""old"" plasma and bluray player. None the less a great TV soundbar for the price.",5,1,2019-8-1,1,1,0
"The soundbar works good but, the owner's installation manual SUCKS!!It has a GIANT remote control, but, NO information on HOW to get it to do the functions!!!",4,1,2020-6-17,1,1,0
I really like this Bose Solo 5. It is everything advertised. I love the extra boost button for sound. It's exactly what I needed. I really like that I can play music from my iPhone or iPad and it sounds great.. The support from Bose is great if you have any problems.,5,1,2017-12-8,1,4,0
"This has great sound over BT for music, but is just meh for TV. I use mine with my Apple TV and it syncs easily with BT and immediately can be controlled with just the Apple TV remote which is awesome. Unfortunately, there is now way to control the mix so on TV shows or Movies the audio can get a bit washed out.",4,1,2020-8-24,1,0,0
Purchased this unit to replace an earlier model of the Bose sound bar which failed to work after several years of use.Like that the unit is compact ands sits nicely in front of the TV without interfering with my TV remote control.,5,1,2020-8-15,1,0,0
Just opened the box. I have no optical output on my tv and the package includes some random cable I've never seen but no coaxial cable.,1,1,2019-5-15,1,3,0
"To be fair, I have had this for over a week and I am still struggling to set it up / get it to work. I'm baffled as to what I am doing wrong or did I receive a bad one. Going to get a technical wizard friend over  and if he can't get it working, its going back. Love the look but so far disappointed.",3,1,2020-7-6,1,0,0
"The sound quality really is quite good from this little speaker. There is a surprising amount of bass for a speaker with no subwoofer and good volume for a medium sized room. This is a definite improvement to any TV’s built-in speakers. Neat features: dialogue enhancement is quite noticeable and effective when turned on, and the universal remote works great with the TV and our Roku. Highly recommended.",5,1,2020-5-10,1,0,0
"This is a good quality product, easy to set up and use, and the sound quality is great for TV and movie watching.  Though the sound is good it is not amazing as in full surround sound.  I am happy with my purchase, it does what I purchased it for.  The added speech/voice mode works well.",5,1,2019-3-21,1,0,0
"Ive been a fan of BOSE since the mid 70's and have 901's for home stereo speakers. The Solo 5 has too much bass and is not adjustable, there is a voice button that is better for news, movies and most tv watching that makes vocals better but bass is still too loud, even uncomfortable at times. The remote is great and replaces the three I had to use for cable, VCR, DVD, and DVR.",3,1,2017-2-6,1,2,0
"Pretty disappointed in this, especially coming from Bose. I am not sure what I expected for the price, but it doesn't put out near the depth of sound I hoped for. It might work in a small room better than a den.",3,1,2020-6-2,1,1,0
"Yes this easy to set up & that's a real plus but the sound quality is always muffled & it's difficult to adjust the volume as visually there is nothing to indicate the volume level going up or down. This is a real detriment to the product. Tv sound is good, music could be better. Simply an OK product.",3,1,2020-9-22,1,0,0
The sound quality stands up to the Bose name however the volume is less than that of the tv current speaker. I have Bluetooth portables that are far louder. Shouldn’t even be sold. Waste of time unless you can hear very well and just want better sound quality. Bose makes great products but this isn’t one of them. Seriously reconsider buying!! I seen people say the volume wasn’t great however I wasn’t looking for much but I never thought it would be this bad.,2,1,2018-11-26,1,2,0
"Bought one for me, love it, sound is crisp and clear. I didn’t realize how much i was missing when they were talking. So good I bought my son one. He loves it and didn’t believe the difference either.",5,1,2020-1-10,1,1,0
"As an older couple, this amplifies the sound to where we can hear every word without the loud background noise.We're so glad we decided to get one and we love the Bose name and quality. The only problem is we seem to be having a little trouble with the remote, despite the fact that the grandkids helped set it up. Not sure if it's defective? How can we purchase a new one?",5,1,2019-12-27,1,0,0
My Yamaha soundbar in my living room is way louder than this one for the same price I purchased this one for. Not very happy,3,1,2020-5-10,1,1,0
"I bought this for my father as a birthday gift and it is everything I was hoping for. My friend has an older model and I was always impressed with the sound quality whenever I’d hear it at his apartment. Now that my father has been using it in his living room, it is incredible in terms of sound quality and ease of use.",5,1,2020-6-8,1,0,0
Not really for me. I have some hearing loss and this sounded muddy to me.I wound up getting a ZVOX which has adjustments for hearing problems.,3,1,2019-8-28,1,1,0
We have tried several sound bars over the years and this one is the best !The Dialog Mode when watching TV makes all the difference when trying to understand what they are saying on a show.,5,1,2017-12-5,1,2,0
"well, Bose did a good job with the looks and sound, but Failed big time with the outdated fullsize 1990's remote that can not be coded for NEW 2018 to present 65"" TCL 4K monitors. BOSE you really need to up your game. i will be returning it and buy another Sonos Beam. its double the price but i only need one remote to control it and the TV.",1,1,2019-10-23,1,1,0
The remote is Half the size of the speaker and has more buttons that you will never use and do not even work. You cannot connect Bluetooth to a computer and the auxiliary connection to a computer has the poorest sound quality ever. Sounds good connected to an iPhone. Tv quality is cheap. How good do you think this product is if it only cost $200 a total waste of money.,1,1,2020-6-15,1,1,0
I have Bose for everything sound related and it’s because once you get used to it you just can’t handle the low quality stuff! It’s smaller so base is not crazy but it’s perfect for our bedroom and the sound is life like I often thing I’m hearing something in RL in the other room and it’s just the sound is that’s good.,5,1,2018-12-31,1,1,0
"For the price, how small it is and the sound has everyone coming to my house asking about it and buying one. Already 4 ppl have bought it after hearing how amazing it sounds with movies and music. Does not need an extra sub woofer or anything just connect it and enjoy. Comes with everything you need plus a universal remote for your TV.",5,1,2020-5-19,1,0,0
I bought this for my husband.  We were looking for a sound bar without a seperate base for space reasons.  He is a huge musice freak and loves the speaker.The size is perfect.  It is not super large and fits perfectly with the 42 inch tv in my hubny dart room. You barley even notice it.,5,1,2020-5-30,1,0,1
I am def not a sound geek. I got it hooked up to my Samsung RU8000 and it's perfect for my condo. I play music on it via Amazon Music and it sounds great. The voice enhancement is really good for movies or shows where the music or noises are louder than the voices. Overall a great buy.,5,1,2020-5-3,1,0,0
"I didn't like that I had to use their universal remote to control the volume on my TV. I looked for ways to make my TV remote the main remote, but it doesn't seem possible. Sound quality was okay. However, my TV is fairly new and the quality seemed the same as the soundbar. There wasn't much differentiation. I liked the idea of a slim soundbar w/o amp but for optimal sound quality, I think an amp is needed.",3,1,2020-5-8,1,1,0
Terrible purchase. First I ordered it and it didn't come with a remote. then I called Amazon and they sent another bar with a remote. Now the remote doesn't work after 5 hours of trying. Now I have to return two bars and an optical cord. Do not waste your money. Junk.,2,1,2019-8-31,1,0,0
This product is awesome.  I replaced an older Samsung home theater system.  There was no comparison necessary.  The Bose soundbar blew the Samsung system totally out of the water.  The Bose Soundbar has fabulous clarity and bass.  It is also bluetooth which is fantastic because everything is better with bluetooth.,5,1,2019-8-8,1,0,0
My wife has hearing difficulties and jears music better than speech. We had a poll which was great but still have her problems listening to speech. This Bose cleans up the signal and has improved her listening ability. Still can't get the bass reduced which would help her while watching movies and programs.,4,1,2020-2-29,1,1,0
"I liked the sound quality-tho the base was not great.  The menu would not come up, so i checked online why.  Unfortunately i found out the remote control is not compatible and there is no upgrade to fix this.  Amazon was great in customer service, so I sent it back.",5,1,2020-5-18,1,0,0
We've owned soundbars in the past...but none of them compare to this one.  It's compact and easy to set up.  The sound quality lives up to the Bose name.  If I had one down side...it's the remote.  It's MASSIVE!  We don't use the remote with the soundbar for our TV...simply the volume on the soundbar.  I love the bluetooth feature.,5,1,2019-8-17,1,0,0
"Another reason why Bose is at the top of the home audio market. Yes, they can be pricey.However the sound and clarity you get from there products are awesome.Excellent upgrade over the tv speakers. Will fill a room with clear dialogue and sound. Nice to have two options for your connection to the tv instead of having to use your hdmi port. Has blue tooth, digital optical inputs as well.",5,1,2020-7-18,1,0,0
"I went for this because of the ratings, but I'm pretty disappointed in the over all volume potential. No reason this should be this capped so quietly with volume settings. I feel I could have gotten a better deal for something half the price and twice the size.",2,1,2020-2-15,1,0,0
"I'm a big fan of Bose, but this one is in the process of a return. Had it connected to a small bedroom and the sound is awful. If there was a sub woofer with this device I would be a keeper.. Not downgrading from a Sony with 300W.",1,1,2019-6-7,1,1,0
Love it.  Not sure why others don’t like it but for $200 bucks I no it sounds pretty darn good.  I have a TCL Roku TV and I had to use code 2471 to get the universal remote synced up.  Plus you have to follow the sequence 3 or 4 times before it will sync.,5,1,2020-9-24,1,0,1
"This thing sounds great!  It's even better since mounting it to the TV with some VESA brackets (not included).  Before I had it sitting on top of a computer tower and the rubber feet stuck out over each side and weren't making contact.  I wasn't super impressed with the sound at this point, but it didn't occur to me that how I had placed it might be the issue.  I had always intended to mount it to the TV, and when I got around to that I noticed that the entire range of sound seemed more open, and the bass much more notable.  Perhaps the way it was placed dampened vibrations somewhere that they shouldn't have been dampened?  The bass is particularly impressive since the system lacks a discrete subwoofer.  The overall clarity is superb, and what I've come to expect from Bose over the years.  Disclaimer: I do not describe myself as an ""audiophile"" and make no grand claims about how discerning my ears are, so YMMV.  That said, I noticed the difference over my previous solution.  It has a nifty feature that boosts dialog, which works spookily well when watching video where the dialog is at 3 and the explosions/score/sound effects are at 11, and sounds pretty weird if you forget to turn it off and play some music ;)  The universal remote is solid and can be programmed to control most people's setups.  It gets loud enough to satisfy me, but if you are the type that likes to occasionally use the volume of your music as a weapon against your neighbors and the general public, it may fail to impress.  My goal was biggest sound in smallest footprint, and especially in this price range I think I did about as well as I can do.  I'm very satisfied with my purchase.",5,1,2018-1-6,1,4,0
"This sound bar hooked up easy.  I also programmed the remote with ease BUT, the sound coming out of the speaker was so quiet, we couldn't hear it.  After going through ALL of the trouble shooting steps, I returned it to Bose, who promptly sent it back with a note that they had updated the software. Unfortunately, there was no improvement.  I'm thankful returning items to Amazon is such an easy process.  :-)This would be an excellent sound bar if it worked with our TV.  The size is perfect & I love how ease the set-up was.",3,1,2020-5-26,1,0,0
I purchased this product in 2018 and a few months after purchasing it stopped working and I'm sure if it was the remote or the soundbar itself. I then reached out to the support staff to either return the product or to get a refund and I've not heard anything from the company since 2018. I'm hoping that this will either get the company to get up off of their a##es and respect the warranty (and after market) option as well.,1,1,2020-1-8,1,1,0
"Great sound.  Bass is solid but not thumping like some would want (probably need a separate sub-woofer for that).  Great remote.  Very versatile and relatively easy to set up and use.  I use it to control the sound bar, the tv, the cable and a Blue- ray DVD player.  Good value for the price.  Revision:  after really understanding the controls, got very good bass response.  Maybe not up to hip hop standards, but solid. Still a great value for the price.",5,1,2019-6-24,1,0,0
"The  sound is great on this.  My husband is alittle hard of hearing.  He still can't understand a few things that are said on tv, but we believe people talk to fast and run words together, which isn't the sound bars fault.  We're pleased with this purchase.",5,1,2020-1-16,1,0,0
"Until this week I would have given this soundbar 4 or 5 stars. Installation was simple, sound quality is good, looks good. My only issues were that it did not retain the dialog mode when powered off & the lack of a volume display. But then this week the 18 month old soundbar simply stopped powering on. After confirming that power, power supply, & remote were OK I called Bosr tech support. $99 to repair & 3 week turnaround. I believe I’ll replace it with another manufacturer’s soundbar instead.",1,1,2018-12-30,1,0,0
This is such a great sound bar for use in any room.  I have an open room into the kitchen and it is on full volume and doesn't disturb people in the other room.  The sound is very high quality.  My only complaint that is the sound is delayed by a half a second to the voice.  But I have a samsung tv so I don't know if it's just my tv.  I would recommend this product.,5,1,2020-7-8,1,0,0
"The speakers on our old TV were not very good and have been replaced once.  The sound was very garbled.  With this Bose speaker, every word is crystal clear.  I did have to change the option on the TV to use ONLY the external speaker and when I use the Spectrum TV cable remote, I have to keep switching back and forth between the AUX and CBL to change the volume or channels.  But that's a small price to pay for not having to replace the TV.  It still has a super picture and is a good size.  I wish I had know about this 2 years when I paid to have new speakers installed in the TV - they only lasted about a year and a half.",5,1,2019-1-2,1,0,0
"There are many different budget TV soundbars available to choose from but I just went to a brand that is trusted over the years.  I had a pleasant experience with the 1st generation Bose solo and very happy with this upgrade, Bose solo 5. Sounds and looks great!!!",5,1,2020-8-21,1,0,0
"The sound is just beautiful. The product performs exactly as advertised. I have other Bose products in my home. They never loose their quality of sound. I have a pair of their original wired speakers, no remote. Which gives me the same beautiful sound in my living room, that did not have remote control just like my new ""wireless"" sound bar in my bedroom, that has a remote.",5,1,2019-10-26,1,0,0
We bought the Bose system because we have elder ears problem with voice clarity when using videos or television. This product has improved or hearing clarity more than we thought possible. Glad we own it even though I have seen disappointment at times by grandkids who sometimes see it as limited.😄,5,1,2016-4-19,1,7,0
"Easy setup, wonderful sound. An excellent product for those with hearing loss/impairment. The speaker has a setting that amplifies voices while diminishing background noises to make speech easier to hear. Highly recommend.",5,1,2020-7-26,1,1,0
