comment,stars,verified,date,country,helpful,has-media
"A little strange to not see your volume level (no display), but the sound quality is fantastic. I have it mounted to my TV, which is mounted to the wall - it all looks very nice and clean. Bluetooth connectivity is great - I can pair it to my phone to play music or podcasts and simply switch it back over to the TV.",5,1,2017-1-30,1,1,0
"I've was going back and forth about buying this speaker after some of the reviews I read, and I continued to go back and forth on it once I got it and heard it's performance. The first thing I noticed is that it really does enhance voices. It also does an excellent job on the midranges and highs, but the bass is definitely lacking. I just kept saying to myself ""this isn't worth the money so I decided to send it back to Amazon and they emailed me a return label for shipping. I was told that I have 30 days to return it so I was in no rush to return it, which may have been a good thing because after a week of using it I've discovered a few positive things about it which have given me a change of heart. So here's the deal...Regarding the lack of bass, while I was expecting more, what I have discovered that it does give you nice bass when it's supposed to. If your watching certain channels, the bass actually sounds pretty good, whereas watching news channels like Fox and CNN the voices are completely without bass, but, this is due to the audio output of the news channel, and while not all TV channels are created equal, neither are movies and shows on Amazon and Netflix. With the first Amazon series it delivered little or no bass, but yesterday I began watching a new series and with that it delivers beautiful bass. This is what I mean about delivering bass when it's supposed to! Does it deliver bass quality matching that of higher priced soundbars with sub-woofers? No, but considering it's small size, it puts out some pretty nice sound when there's heavy bass present in the TV audio. My advice to you would be to use it with the bass adjustment all the way up while not using the voice enhancement option which actually lowers the bass, and in my opinion, makes the voices a bit too tinny.  It also performs more like a Bose speaker when streaming music through it. Lots of bass for that. Hope this helps!",4,1,2019-8-17,1,3,0
"Very disappointed in this product. Purchased this product on April 20, 2017 and as of September 1, 2017, we are unable to operate the volume of the unit with the remote control. We have replaced the batteries in the remote and still the system is difficult to control the volume. It is intermittent. I would think the product would be covered with a warranty and last longer than 5 months of use. Very disappointed after paying $249.00 for this unit. Won't be purchasing further Bose products.",1,1,2017-9-14,1,7,0
"I do like sound bars but, this product always forces you to press a button to hear clearer speech rather than just have it on all the time. I was expecting more from Bose.",3,1,2018-1-23,1,4,0
"I originally ordered this for my wife as she has a hard time hearing the dialog in TV shows, movies, etc.  I have a nice Polk Audio sound bar with subwoofer that has worked well for us, but thought maybe the Bose could compete with the sound output plus give us the extra dialog advantage.The install was simple and I used an optical cable for install.  That and the size of the unit are about the end of my positive feedback.  Don't get me wrong, if you want this for dialog clarity, it will give you that.  Just don't expect much other sound when in the dialog mode that is separate from normal mode.",2,1,2018-11-30,1,2,0
"After a lifetime of working in and around industrial sites my husband is a bit hard of hearing. We are constantly battling over the sound of the TV... I can hear normally, so when he puts the sound at level he can hear the conversations, it feels like it is blasting our my ear drums!  We've had several sets of headphones... they are uncomfortable and he then can't hear me if I am asking him something...  so we decided to give this a try.  A couple of things... neither of are ""techies"" and were able to plug into our newer (less than 2 months old Samsung 65"" TV) in an instant.  So that was good.  If you turn it on it is an amazing sound upgrade from your TV sound system.  Very noticeable.  When you push the little conversation icon which is supposed to ""enhance"" the conversation portion of the sound, it is noticeable.  Perhaps not as dramatic, but it helps.  We are able to find a happy medium.  You are able to adjust the bass when you don't feel like having the ""theater"" experience.  It is a ""bar"" that sits just below our wall - hung TV.  It's about 30 or so inches long and about 3"" tall.  It does have the Bose logo right in the middle.  At first I wasn't thrilled about looking at it ... but I find I don't notice it now and it sort of helps to hide the cords - bonus.  As noted on other reviews... you do have to click on the ""conversation icon"" to ""enhance"" the conversation sound every single time you turn it on.  It would be nice if it just stayed on that position.  Also, it would NOT ""learn"" my new Samsung blue ray player or my TV... so the ""universal remote"" thing is not really happening.  The remote is very large and cumbersome for just turning on and off the sound bar...  I even researched the internet to be certain I had the right ""universal codes"" for my DVD player... Still didn't work.  So.... if you don't really care about adding just one more remote the sound quality is truly an upgrade from your TV. It really makes the sound match the quality of the picture I am seeing on my TV.  The conversation enhancement is noticeable, but maybe not as dramatic as you might hope - still - it's helpful.  We are definitely keeping it.  I never shy away from updating my reviews if new info would be helpful.  Further, I do NOT receive compensation of ANY kind for my reviews.",4,1,2016-8-8,1,2,0
"I was hesitant when I first purchased this product. I didn't know if it was going to be a knock off, or if it was going to have problems once I installed it. This is the REAL DEAL! I love the sound. It was super easy to install. It's sleek, it's powerful and the price was PERFECT!",5,1,2017-1-19,1,5,0
"Honestly, this isn't much better than my TV speakers (2014 Samsung 48"" UNH6350) - Really, the only difference is that the Bose Solo 5 has a little bass AND more centered speakers. Compared to the TV speakers, which are more stereoscopic (even if they are rear-facing) the sound coming from the Bose Solo 5 is a little crisper (tinier) and barely stereo. In fact, the best set-up so far is to have both the TV rear facing speakers AND the Bose Solo 5 speakers enabled at the same time. I get a much richer audio experience with proper stereo from the TV and a crisper high's and more bass in the center from the Bose.The remote is awesome, however. The code worked fine and I'm able to use it normally, though, with both the TV speakers AND the Bose speaker enabled, It doesn't cut down on a remote. (Do universal remotes ever do?)",3,1,2017-12-4,1,3,0
"Some fifty plus years ago I took Prof Bose's Network course at MIT, 6.01. Several friends and colleagues went with Amar to Bose. My wife and colleagues at MIT built Bose speakers which we still have. Thus I thought this would be a great little speaker.The sound is not bad for the price and the system works well as a separate speaker if you ignore all the directions. The problem:",3,1,2019-8-16,1,1,0
"Solo 5 best for small rooms/less than 50"" tv's. Adequate sound for the price but not the what I expect from Bose. I have owned Bose for decades (Lifestyle, sound bars, radio) but now conclude Bose is no longer the sound technology leader it was 20 yrs ago yet they command the price differential. There are better sound bars available at this price point (my Samsung sounds better, same room, same tv, better/simpler remote).PRO:",4,1,2018-11-4,1,2,0
"I wanted Bose because, well, it's Bose.  I bought Bose.  I returned this Bose.This sound bar has some PROs and many CONs to it.",2,1,2020-3-12,1,1,0
This product was great until it just stopped working. It’s only been one year! I thought Bose had a much better product than this:( WHAT A JOKE!!! $250 for one year then it breaks on me right at the 1 year mark. Super disappointed in this whole Amazon purchase:(C’mon Amazon and Bose pick it up a notch please!:),1,1,2018-8-31,1,2,0
"My old boyfriend had a Bose system in his car and it sounded amazing.  My sister has that radio/CD combo they promoted on TV for years and it sounds amazing.  Last year I broke down and got the little portable $100 unit to use with my kindle.  I couldn't believe I finally got myself a Bose and it was also AMAZING!  The clarity and richness of the sound blew me away.  I just wanted MORE!  I had a Vizio soundbar that suddenly wasn't so appealing.  It was a big decision to upgrade a perfectly functional soundbar that was expensive enough but I had become a Bose addict.Now I'm not suggesting this is a knock off and I don't think it is but I was shocked that it didn't sound any different than the Vizio (if not worse).  Trying to deflect the scorn of my husband I marveled at the new  ""Dialogue Mode"" which also wasn't impressive.  Unwilling to admit my mistake it stayed.",2,1,2020-1-17,1,1,0
"Compact, doesn’t block the eye on my tv for the remote control. The only thing I don’t like is there is no interface, what number is the volume level? The bass level?  No on off switch without the remote control.Comes with an optical instead of an hdmi. Honestly my tv came with more smart features and wasn’t much more expensive.  Subwoofer is blah, I still need to plug in my real woofer for any depth of sound otherwise voices sound funky.",3,1,2020-1-13,1,2,0
I really don't know what to say. I have a Yamaha Amp and all Bose speakers but the amp is old and it just has to many wires. I had a Vizio sound bar with bluetooth sub and could mate any bluetooth sound device to that unit and it was almost comparative to my Yam/Bose system at 2/3 the price of this soundbar.  Sadly after several years of use distance of bluetooth started to diminish and when it wouldn't reach the sub any more it was time to go.I have not had a soundbar for two or three years since disposing the Vizio. We bought a new OLED LG television last year and honestly the sound is great. I saw this Bose unit and figured it would be an improvement to our television watching experience. It wasn't ! The quality was terrible with an almost muffled sound that added nothing to the experience of watching television. I thought maybe it was me but after inviting several friends over their opinion mirrored mine.,1,1,2019-12-20,1,2,0
"If you’re looking for great sound and you don’t need something to shake the walls, this is what you want. I’ve tried it with movies, tv shows, ball games...the sound is clear and you hear everything you should. I’m hearing dialogue in the background of movies I’ve seen countless times that I had never heard before. You’ll never go back to tv speakers again. My only critique is that the remote is a bit excessive. I already have a remote to control everything else and it seemed like a bit much to me to have that for a sound bar remote, but at least you can set it to turn everything, including the sound bar, off all at once so you will have to judge the usefulness for yourself. Finally, this does come with an optical cable. I don’t know why Amazon wants to sell you one with it because it’s not necessary.",5,1,2019-5-12,1,3,1
"I don't feel like this has the same audio quality I've heard from other Bose products. I've owned many, and I use their quiet comfort headphones on a regular basis when travelling. I decided to take a chance with a deal on a used Bose soundbar. The price was right, and I just needed it for a TV with less than optimal sound in my guest bedroom. I expected the same sound quality that I'd heard from other Bose products.This, however, seems a bit more mid heavy and lacks much bass punch. I expected a bit more from Bose, as even their tiniest Bluetooth speakers sound pretty decent. It's definitely a step up from the TV speakers, but if I had to do it again, I would pick a soundbar with a proper subwoofer.",3,1,2020-1-21,1,1,0
"I am very impressed with this sound bar. I've watched a few movies with it hooked up to my TV. It certainly has amazing sound for its size. Is exactly what I was hoping to find. I was looking for a sound bar that was relatively short in length and compact. This one just the bill perfectly. I wouldn't recommend it for large rooms. Fortunately I live in a small apartment and this feels the room with amazingly clear sound. I own two other Bose products and they have not disappointed me at all. I can say the same for this product I washed one movie with a friend of mine who is hard of hearing so we had to have it turned up rather loud and I had to turn it down multiple times so that we could discuss the movie. I have had it turned up to the max volume and it does not become distorted at all.It took me about an hour to figure out how to program the universal remote to my TV. This is probably the biggest challenge I had while setting up the sound bar. I would highly recommend this to anyone who lives in a small apartment as I do or to anyone who is looking for a good quality Bluetooth speaker. The universal remote took the place of two of my other remotes and takes a bit of getting used to. All in all it is a very nice well-built, well designed remote.",5,1,2019-9-2,1,1,0
"I bought the product based on the Bose name recognition for good speakers. Big mistake. These guys still live in the dark ages. It is 2020 and one expects a small display (like Samsung and other brands have) to tell you what is going on with your sound bar. Instead there are only two lcd lights (like in the 1970s) that you have to guess based on the color what they mean. There is no indicator for volume level so you have no idea where you are. Absolutely unacceptable. You do not know which input is on because you just pressed the input button on the remote and after a second the light is gone. The sound is not better than my Visio TV. I do not even know why I kept the bar, probably I am too lazy to repackage it and ship it back. The speech is somewhat improved but that is no reason to spend $180. All in all it feels like a cheap imitation, do yourself a favor do not buy this Bose product. Once upon a time Bose was equivalent of sound quality, not any longer and if they stay like this behind the other competitors they will be soon without customers. I gave it two stars but even that is too much for such a weak sound.Second thought:",4,1,2020-6-10,1,1,0
"This sound bar did not live up to the Bose name. The sound is really bad, at low volume it sounds great at mid volume there is a lot of noice coming from the speakers, bass is lacking, the Bose mini soundlink sounds louder and a lot better than this. At high volume there is a ringing noise that sounds like the dog whistle application you can get on your phone. Will not recommend this product if planning to listen to it at anything other than low volume.",2,1,2018-11-28,1,4,0
"Hook up was a breeze and I'm a completely non-technical person.  Took about 10 minutes and I was going very slow and deliberately.  I really like the sound - it doesn't separate the music all that well but it's only a couple feet + long so I didn't expect it to do so - the bass is good, very clear and distinct.  As I'm 66 years old, I got it to help me understand the dialogue better when we watch movies - the button on the remote to clarify the dialogue is helpful - haven't watched enough flicks to judge definitively - I'll check back later with an update on it.",4,1,2017-8-23,1,2,0
"Got the Solo 5 to improve on the internal speakers on a 24"" TV in our bedroom.  Have used Bose speakers for years, love the Bose sound, and was looking for the Solo 5 to provide the good, rich, natural sound I associate with Bose.  Total fiasco.  The Solo 5 sound was thin and tinny.  As far from rich and natural as can be.  Barely heard any bass, even with bass control turned up.  Immediately returned the Solo 5 and ordered the Edifier R1850DB Active Bookshelf Speakers.  Got them next day with free delivery via my Amazon Prime membership.  Like the Solo 5, the Edifier speakers can be fed with an optical digital audio cable (included) - the only audio output jack on our Samsung TV.  The Edifiers are admittedly a bit bigger and bulkier, but they still fit our limited space in the bedroom. And most important, they sound great -- just the sort of sound I was hoping for but never got from the Solo 5.  Oh, and one thing more: they're cheaper than the Solo 5.",1,1,2017-12-3,1,3,0
"I was excited to come home and set this up but I was soon to be let down. Bose knows sound, Bose knows audio. Unfortunately they missed it with this one.Pros: easy installation, very good looking.",1,1,2016-11-29,1,1,0
"I love my Bose Solo TV sound system as my new slim TV does not have the speakers that my old very large TV had.  This sound bar gives the deep rich tone that all quality speakers have and makes it easier to understand voices and music.  The only problem I have is that the Bose and  TV are in the bedroom, and the bass is very dominate on this speaker, so if I forget to turn the bass down, my husband and my dog let me know.  The only negative statement I have about this sound bar is it should allow you to set the bass level where you want it to be and hold it there - currently when you turn the TV off, the Bose sound bar reverts back to the factory set bass level.  I recommend this purchase.",5,1,2018-7-18,1,1,0
Stopped working after 2 months! For $ 225 it didn't last. Very disappointed because the return window is closed. ...,1,1,2018-2-11,1,2,0
"remote pairing with my Phillips TV and Fios is not working very easily. Not sure if I'm doing something wrong or what, but when I turn on the TV, the sound bar doesn't come on, and if I turn on sound bar separately after I turn on the TV, the TV cuts out or Fios... Also on FIOS whenever I switch to the YouTube channel from the FIOS guide, the soundbar blanks out and we hear no sound.  very dissatisfied.",1,1,2018-8-25,1,1,0
"I considering myself a casual audiophile. It's not my hobby, but I appreciate equipment that works well. I was having a hard time hearing dialog from my aging Panasonic plasma TV. Options were limited due to my narrow TV stand, a re-purposed stereo rack. I'm not normally a Bose fan, but this had the right width, lots of good reviews and a decent, if high-ish, price.Dialog, as expected, is fine. Noticed that orchestral music in soundtracks is surprisingly full and rich. Decent bass reproduction, but bear in mind that you won't hear much unless your movie or show has deep bass- it can't reproduce what's not there!  Built-in amp seems sufficient. Haven't cranked it all the way up, but I've gone as loud as I like with hardly any noticeable distortion. Haven't tested it much as a BlueTooth music speaker, but I expect that it'll do fine.",4,1,2020-3-20,1,1,0
This is a wonderful piece of equipment.  It has been a great addition to my TV sound and makes every thing so clear.  I am very pleased with this purchase!!!,5,1,2016-10-11,1,4,0
"For just just myself I would have bought a larger sound system, but my other half was not a fan of that idea. Perhaps in the next house.The Solo 5 is much better than the Sony X900F TV speakers. Some bass versus very little base. A fuller mid-range and gets rid of the tinniness. Music played over it is very pleasant.",4,1,2019-1-4,1,1,1
We had a Vizio soundbar for years but always had an issue with the dialogue in movies. The background noise and music would drown out the dialogue and it was a constant battle between my husband and I. He’d switch the sound back to TV and then I’d switch it back to the soundbar.This was well worth the splurge. I already had a couple of Bose Bluetooth speakers so knew I liked the sound quality. It took minutes to set up. I programmed my cable remote to control the soundbar rather than using the included universal remote. We’re both really happy with the sound. Much richer than the other soundbar and 100x better than the TVs internal speakers. No more problems hearing dialogue.,5,1,2019-1-27,1,1,0
We bought this due to our frustration with unclear dialogue with our Vizio TV.  It was easy to set up and has definitely improved our TV experience.  We also have it connected via Bluetooth to our Echo Show.  There's not much physical separation between the left and right channels so don't buy it to get a home theater experience.  But if you find yourself using closed captioning because you can hear but not understand what people say this is an excellent choice.,5,1,2018-2-14,1,1,0
"Purchased this to get some better sound out of a wall mounted TV without having to go to the trouble of getting a receiver, etc.  The only way to adjust the volume is to use their proprietary remote control.  We have Comcast Xfinity which also has a proprietary remote for changing channels, but has the capability of controlling other devices. I've seen in some of the reviews that BOSE doesn't have a code for operating this unit and prefers to have you use their included universal remote which does NOT work with Comcast Xfinity functionality. The unit is basically worthless as even when you control it, there is no feedback to indicate sound level setting. As far as sound output, the crappy speakers on the wall mounted TV sound just as good as the BOSE and you can't tell the difference.  Thought BOSE would offer some clarity of sound, but it just doesn't deliver.... Wasted purchase.",1,1,2020-8-4,1,3,0
"Unit was very well made, but thatis the best I can say!  If thhis device came on the scene 5 or 6 years, it would have been in the top 25% of soundbars, but today, it is less than so-so.  The control would not pair with my Samsung smart TV or latest Comcast cabel box ( and yes I ran through all the codes).  The vocal enhancement is inferior to that on the Samsung smart TV.  The Bose unit only has ""bass"" control, and that goes quickly from a fake boomy to nothing in a click or three on the remote-again, the Samsung TV needs adjusted to tailor the sound and, unfortunately, needs redone for each source.OK, who is this good for?  I would suggest a smallish college dorm, for occassional listening.  But, again, way over priced!  If this were a $75.00 unit, instead of $200.00 and you were making your first foray into music different than MP3 downloads, you might like it.  But I've had this now several weeks, trying to let the speakers burn in, but if anything, the sound only gets more aggravating.  It is well built, though!",2,1,2019-11-3,1,3,0
"We bought this soundbar for a TV in our bedroom that is wall mounted.  We mounted the Bose Solo 5 on the wall just under the TV.  The improvement in sound from the TV speakers is remarkable - definitely Bose quality in a small package.  Obviously the sound quality from this soundbar does not compare to a surround sound system or even a larger soundbar.  This soundbar has better base quality when it sits away from the wall a little, but there is a built in adjustment for wall mounted applications that does a good job of rebalancing the sound.  We had some space limitations both in terms of length and depth of the bar.  This was a perfect solution for what we were looking for and the sound quality is much better than some of the other soundbars we tried.  Additionally, hooking up your phone or other Bluetooth enabled device to play music is very easy.  We use this device exclusively now to play music in our bedroom.  The remote is a bit big, but it is chock full of features.  We have the soundbar connected to a smart TV with an Apple TV connected as well.  The included remote is able to control all of the functions of the TV, the soundbar, and the Apple TV without selecting different devices.  Press one button and the TV, soundbar, and Apple TV all power on or off, and as far as we can tell all functions of each of the devices can be controlled by the remote without much setup effort.  Definitely recommend this soundbar.",5,1,2019-4-29,1,3,0
"I purchased this soundbar because I have a hard time hearing dialogue while watching TV.  This soundbar advertised a special dialogue mode to enhance the voice level.  It does a good job boosting voice levels, but it falls very short in other parts of broadcast audio.  I have a Sony CT370 soundbar to compare with.  Voice clarity with the Bose soundbar was slightly better than the enhanced voice setting for the Sony.  Special effects, sound effects and music on broadcasts on the Bose was very flat compared to the Sony.  Also, if you like to listen to music via your DVD player or Bluetooth device, the Bose will be a disappointment.  Frequencies are flat.  Music played on my Sony was exponentially better.  The fact that the Sony comes with a subwoffer contributes to it's better sound quality.  I agree that the Bose soundbar is an improvement over a TV's built-in speakers, but it falls well short of other comparably priced soundbars on the market like the Sony CT370.",2,1,2019-10-9,1,3,0
