comment,stars,verified,date,country,helpful,has-media
"This is a great soundbar if you don't need knock your socks off bass and surround sound.  I have an average size living room and it's more than enough sound for me.  The dialog feature is amazing and brings crystal clear conversations to light.  So, if you're looking to shake your walls with sound effects this soundbar is not for you.  If you're a casual tv/movie or gamer this is miles above your TV speakers.",4,0,2018-3-11,1,1,0
"I purchased this as a gift for my friend who complains about their TV's sound not being up to par. I have a soundbar myself and it completely changed my viewing experience, so I got him this one because he likes Bose products. Wow. This sounds like a tiny $150 TV someone would have in a dorm room, mixed in with some weirdly muddy bass that only seems to come on at the wrong time. Do yourself a favor, if you want a budget-friendly soundbar, save $50 and get one from Sony with a built-in subwoofer. It is so much better. I ran around Manhattan 6 days before Christmas looking for this thing only to have to return it. Seems Bose stores don't actually sell this product and I can see why. Horrible.",2,0,2018-12-20,1,0,0
"I am a 73 year old man and a little hard of hearing. I bought this because of the voice button. I foung no decernable difference between the regular setting and the voice control. However the biggest problem is the speaker doesn't get very loud, this has been pointed out by others. I just ordered a ZVOX SB380 which was designed with the hard of hearing in mind, and there is a world of difference between the two. Bose is over rated!!",1,0,2018-12-29,1,1,0
"Kind of dissapointed with Bose. I own several Bose surround sound systems and they are great. Decided to purchase this for my living room for videos, music etc. This one, NOT SO GREAT. I purchased this to replace my LG soundbar, and truthfully my LG soundbar is much better. This soundbar is definitely for an office, kitchen, or bedroom. NOT FOR LIVING ROOM. For a few more bucks I could have gotten something worthwhile.",3,0,2020-4-9,1,0,0
"I bought this from BestBuy for a new kitchen TV.  Probably a personal thing, but it sounds ok for TV but horrible for music (Roku Spotify).  The sound is typical Bose but with a ""plastic"" sound added on top - bad.  I had to return it and opted on a pair of powered bookshelf speakers, which work wonderfully!",1,0,2019-5-8,1,1,0
"The unit arrived today. The sound is a notable improvement over the sound from my TV set. However, I am unable to program the remote to use the tv or cable box. So farI am only using the remote to turn the soundbar on and adjust the volume. But the small size and decent sound makes it worth the price...",4,0,2018-11-22,1,0,0
"I've had this soundbar for a couple of years now.  When it works, the sound quality is excellent.  Unfortunately, every now and then it refuses to turn on.  Unplugging it and plugging it back in sometimes works.  Overall, I'd give this a POS rating.",2,0,2019-8-3,1,0,0
This thing is a piece of junk I bought it for Samsung TV that does not have a great sound and the sound on the Samsung TV is better is absolutely the worst purchase I’ve ever made along with the sound bar that I bought to replace it horrible quality,1,0,2020-9-22,1,0,0
"My father in law bought one of these as usual Bose delivers. As a small soundbar, it makes big sound and low bass. Makes all dialogue crystal clear;great for talk shows/sports. Also Amazon offers a bundle with an optical cable which is completely unnecessary seeing as Bose packages an optical cable connection in the box!",5,0,2018-6-4,1,1,0
"As more and more TV companies are placing their speakers in the back, if you have your TV wall mounted, there no clarity on the sound output.If you are looking to supplement with quality sound and at the same time do not want too many things in your living room, this will serve the purpose wonderfully.",4,0,2016-6-9,1,1,0
"I have always liked and thought Bose to be top of the line, however, now I am no longer sure. This product was very easy to set up and operate until it stopped working. After less then a year of use, I was watching a program with the Bose solo 5 speaker, and all of a sudden it just stopped working, and it has not worked since. Very disappointed.",1,0,2018-10-7,1,1,0
"I am a huge bose fan, not so much a fan of the prices (but if you want the best). But they hit this one out of the park, great sound quality, super easy to set up ( a monkey could do it), and I love the universal remote. Has a custom power button to turn on/off multiple devices. And like I said before you can't beat the price for the quality your getting.",5,0,2018-12-9,1,1,0
"DO NOT BELIEVE THE NEGATIVE REVIEWS. Just received this and it literally took 30 seconds to connect. Just plug it in and hoop up the optical cable and you are done!!!! THATS IT!!! Next I used Bose universal remote and connected it to my Samsung TV and to my Direct TV box. If you read the directions and the codes given, by Bose, that was about a minute. So in a minute and a half I was completely up and running. As for the sound; it comes pretty amazing with the presets. I did however press the ""dialogue button"" and boom; instant difference. The book also shows you how to change the bass as well.My ONLY negative feedback is that the device doesn't show you what volume level you are at. Other than that minor detail.....this thing rocks!!! Another note to the negative review; a sound bar should be instead of your tv sound and is not to be used with your tv sound. Turn your tv volume all the way down, turn your sound at up, and enjoy!!!!!! Big sound out of the smallest soundbar. Thanks Bose for making an affordable soundbar that sounds amazing!!!!",5,0,2017-4-18,1,1,0
"Was good while it worked. Company does not back any product.  Pay a lot now for it, then throw it out later since it will cost you the purchase price to have it repaired.  TERRIBLE!! BOOO!",1,0,2020-1-2,1,2,0
"Sound is front facing and clear.  Salesman lied about quieting commercials, it does not.  The third party remote is junk. It does not control devices consistently. Made several calls to Bose. It doesn’t turn everything on and off every time.  Syncing does not work.  Wife hates the multi remote game.",2,0,2017-11-21,1,2,0
"Our Samsung TV has a great picture but the cable's sound was total crap. It would go back and forth, and for awhile, I thought it was me. No, the cable's audio is garbage.Trust Bose. I gave my mother a Wave radio/cd player years back, and we have Bose powered speakers that wre student stuff for a kid, and when the Solo soundbar came out, my wife bought it for me as a gift.",5,0,2017-6-19,1,0,0
"We have been very pleased with this soundbar. It is nice and compact but provides a great improvement in the sound from a flat screen TV. There are several alternative ways to connect it to the TV but the best method is to use the optical cable, assuming your TV has a connection for this.We also use the soundbar for watching concerts and listening to music on You-tube. Our computer doesn't have an optical connection but we can connect the Bose to it by bluetooth, which usually gives good results. I am very happy with the sound quality, and use the Bose as a better alternative than my computer speakers. I even think that the bass is pretty good. Despite not having a separate sub-woofer, we can get quite an oomph from the bass.",5,0,2017-8-25,1,0,0
"Wanted something to sound really nice in the morning because everyone is tired and quiet so we just watch the news and with new TVs these days is essential to have some kind of sound bar to go with it and when I got this little Bose from there website I was just blown away at how crisp the words are and overall the sound, we spend a lot more time in the kitchen during the week now! I also own the Bose SoundTouch 300 SoundBar with the subwoofer that goes with it hooked up to my Samsung 75” QLED Q8C 4K Curved TV that’s like the family movie theater but very awesome audio coming out of the new SoundTouch 300 series!",5,0,2017-11-7,1,0,0
"After about a year to 18 months, it just stopped working.  There are no buttons so there's no way to confirm that it's even getting power.  I called customer service, they told me to unplug it for a minute to reset it and that when I plug it back i, I should hear a few beeps.  I didn't, so it appears to be plain dead.  I tried numerous outlets.  The next option was to mail it back to Bose and they would fix it for $99.  Complete waste of time and money for a mediocre product that didn't last and that isn't backed by its manufacturer.",1,0,2019-8-20,1,2,0
The sound out of this was barely different than my TV's built in sound. If I was in a blind test of this I probably wouldn't be able to tell at all. It's hard to adjust the settings with only a couple of LEDs serving multiple functions. I expected so much more form a Bose. Returned it the next day.,1,0,2017-11-6,1,3,0
"I got my Bose speaker as a gift last Christmas (Dec.2017) today it stopped working.  I can’t turn it on.  No power . I have tried everything to reset it, but it won’t turn on.  Seems so disappointing for such a quality brand name.",1,0,2018-10-29,1,2,0
"First, I have a good quality older flat panel TV (with actually pretty good speakers) so wasn’t looking to upgrade to a whole 5 speaker system, but I thought getting some deeper bass while watching movies would be nice.Second, I also was very interested in a simple setup –with young kids I have very little time to mess around with connection problems and really need something to work out of the box.  (Gone are the days I could spend hours troubleshooting wireless connectivity or blinking lights!)",5,0,2016-4-29,1,5,0
"This sound bar is very easy to connect.  But unfortunately this is about the only positive in my opinion for a larger room.  I need to preface this review by comparing it to a Polk system that we are replacing due to malfunction where sound will stop and start periodically.  The Bose system lacks bass and volume levels that we are used to experiencing.  Our living room is about 17x17 so maybe the Bose would work in a smaller room.  However for our need, the Bose system was under powered. At this price point I would recommend a sound bar with a separate sub woofer.",3,0,2018-12-7,1,0,0
"My current TV has the speakers in the back and this made it difficult to hear most things. I was also tired of the sound jumping up and down. For instance, I couldn't hear people talking very well so I would turn the volume up and then action would happen and it was too loud. This seemed to be happening frequently and I was constantly being asked by the family to turn the volume up or down. To solve the problem I bought this Bose 5. I've always wanted a Bose speaker system because of the quality and amazing sound they produce even with smaller systems. This Bose 5 is no different, I fell in love with it within the first 5 minutes.The sound is great, the dialog option is great, it looks great and the remote is awesome. Unlike some of the other people who reviewed this I had no issues hooking it up and programing the remote. It even came with a separate booklet just for codes to program the remote, I've never seen that before! I have my DVR, TV, X-Box One, and phone all programed in the remote. One push of the power button turns the TV, DVR, and Bose 5 on or off. One push of the Bluetooth button connects to my phone to stream music. But it also comes with an option in setup to where the Bose, while turned off, can detect if sound is coming through a device it is hooked up to and will automatically turn on. And will also turn off after a period of time if there is no sound. Say I turn everything on with the remote that came with my Cable company's DVR and I don't have the Bose programed in that remote. The bar will come on automatically with the TV once it detects audio coming from it. Love it!",5,0,2017-1-20,1,0,0
"It annoys everyone who watches tv, because the sync between sound and voice is so off.  Then, it doesn't sound any better than the speakers on my lg tv - and after careful experimentation with quite a few people, there is no difference in sound between the green light of normal sound quality, and the amber light on of 'voice' enhancement.  If the box and all the paperwork hadn't gotten thrown away, I would return it to the store I bought it at.",2,0,2019-12-8,1,0,0
"I bought this to replace an original Bose Solo that died after about five years.  I'm giving it five stars because it does exactly what I want it to do, and that is improve the tinny sound that comes from the LG TV.  It is not a booming surround sound unit, but it's a 100% improvement over the native TV speakers and volume and bass are perfectly adequate for my purposes.  Price is very reasonable; took about two minutes to install (plug it in and connect the included optical cable) and maybe four minutes to program the included universal remote (which is a good one) to operate the sound bar, TV, DVR and satellite box.",5,0,2017-12-16,1,0,0
great if your sitting in a cardboard box. this thing produces little to no sound. i turned my tv speakers back on to compare and my tv is louder than the speaker. for 200 bucks its pretty pathetic.,1,0,2019-12-27,1,1,0
"I was going on the premise that Bose give good quality in sound.  However, when I purchased this sound bar.  Sounded good in the store but was truly disappointed when I took it home.  For $250 this is not worth it.  I know you do not get the bass like a theatre system but still what you get is just basic.  Disappointed with this product.  Bose you need to upgrade this model or reduce cost to reflect sound quality.",3,0,2016-11-3,1,2,0
"Either I ended up with a lemon, half these reviews are fake or people have this speaker is some little room.  I bought one six months ago and this thing is a pos.  My television speakers are louder than this thing.  Is the sound ""quality"" better?  Possibly but you still have to be able to hear it which requires volume which this thing doesn't have enough of.  If I realized there were only two tiny speakers in it I would have saved my 250 bucks.  I think the whole Bose thing is a scam.  You got me once.  Never again.",1,0,2017-8-12,1,2,0
"It suddenly stopped powering on, after sitting on a shelf for a little over a year without anything happening to it.After ruling out the obvious causes like a broken outlet, dead remote batteries, etc. I googled and found lots of other customers having the same issue. If you're lucky and within warranty, they will fix it, if your like us a few months out of warranty, it's $99.",1,0,2020-7-21,1,0,0
The sound is excellent and the size is perfect. This was a replacement for a much older Bose bar with a huge subwoofer. Less is more and I did not want that monstrosity taking up floor space any longer.,5,0,2019-7-6,1,0,0
"Nothing special.  Sound wasn't exciting and didn't beat out my off-brand sound bar that cost about the same price. Surprised by this...Sound didn't have anything special about it, and didn't have any richness to it :(",2,0,2019-9-22,1,0,0
"Can only be controlled with the remote. If you have kids that often misplace the remote, be aware there are no controls on the unite. Simply ridiculous.The sound quality is ok. Nothing spectacular IMO but way better than the skimpy speakers on out TV.",2,0,2018-4-25,1,0,0
"I bought this because we are baby-proofing the living room which means hiding or getting rid of entirely a lot of stereo components - hence, bye-bye receiver, subwoofer, speakers, and speaker stands (not to mention NES and VCR). This compact, button-less unit that sits discreetly on the TV stand is a lot less attractive to the little one than our old stereo receiver with its myriad knobs, buttons, and blinking colored lights.As for the sound, I am impressed. Even without a subwoofer component, it sounds like there is one in the room on a low setting. It's not the booming, house-shaking experience it was with the powered component sub, but it is highly passable and, honestly, much more practical.",5,0,2017-2-13,1,0,0
"I had one, stopped working. Bought another, it just died like the other one.",1,0,2017-6-11,1,3,0
I expected more from Bose.  The sound is just average.  The supplied remote makes it overly complex to operate the speaker.  Our Similar earlier Bose design had better bass and a simple 4 button remote for volume / mute / on-off,3,0,2019-4-17,1,0,0
I have been a huge Bose fan all my life. This is the first product by them that I can honestly say was a big dissapointment. The sound was not the usual Bose full room experience but rather what I would expect from a cheap no-name brand. It was basially like adding a 3rd speaker to the TV. It did nothing to enhance the sound in any way. Returning it for something else....,1,0,2018-1-2,1,2,0
"The Bose Solo 5 Sound System has a solid sound, although I like how my older Onkyo [http://smile.amazon.com/gp/product/B00EE18LPM] performs better, probably due to its larger size. The Bose bar is nice and slim and can be wall-mounted (as an additional purchase). The set-up is easy, although the optical cable is short (as they all seem to be) so it can't be positioned how I'd like it to be. I had the most trouble with the remote and it took some doing to get everything to work properly. I'm usually pretty good with those things, so I don't know if I was having an off day with it or if Bose just made it more difficult. Eventually I figured it out (mostly) and am able to change bass and other settings. I'm keeping my Onkyo connected to the TV and using the Bose for Blu-Tooth, which I had zero problems syncing with my devices. Still, hearing about how great Bose sound is, I am disappointed. It doesn't sound bad by any means, but I'm definitely not blown away. Recommended if on a sale.",4,0,2016-3-28,1,1,0
"If your expecting a typical Bose sound, don’t buy this one.  Very cheap sounding. Low end components.  Buy the Alpine, you’ll be happier for less money",1,0,2020-4-29,1,1,0
"Retracted the last review i just had to reset the sound bar left it unplugged for a day and plugged back in and yes it makes a big difference would i recommend it yes i sure would, you can't go wrong with bose, the sound is nice and loud and the base is decent , and so is the mids range, i can definitely tell a difference now even on my new LG UHD tv.",5,0,2017-5-27,1,0,0
"Awesome sound bar! We have it mounted in our bedroom and couldn't be happier. This little thing packs a punch without a bulky subwoofer. Cool, crisp, full sound, fill the room with this bad boy. I was a bit skeptical at first but liked what I heard in the store. For $219.99 with the mount inlcuded at Costco, this was a steal in my opinion. Hooked it up with one optical connection and away it goes! The Bose Solo 5 is also Dolby Digital compatible so if your TV will pass a Dolby signal, the sound bar can decode it. Sounds awesome!",5,0,2017-2-25,1,1,0
"I know Bose always makes excellent products, but I was extra impressed with this one. I got it just for the TV speakers, and was pleasantly surprised that it has Bluetooth to play music from my iPhone when I’m not watching TV.The setup was easy, the universal remote controls everything I need it to, and it just works wonderfully.",5,0,2018-1-3,1,0,0
I like that this sound bar is not an eyesore and that it has all the sound an eyesore would.,5,0,2018-12-31,1,1,0
"So AFTER I purchased from Amazon, I found that this was available at Sam’s for a lesser price PLUS it came with a mount that wasn’t included with mine.  The power cord and included audio cable are FAR too short to fish behind a wall sadly. I would expect better from Bose on these details.",3,0,2018-6-23,1,0,0
Excellent sound for a speaker this size.  Makes a huge difference when watching anything on TV.  I also use the Bluetooth for listening to music via my cellphone.,5,0,2018-12-27,1,1,0
"Product randomly died right outside of warranty.  This seems to be a known defect, with a lot of complaints on the Bose forum. Customer service solution?  Pay us $99 and send it back, we will fix it for you.  Terrible customer service experience for a known defect on a high end electronic that sits on your tv stand and should work well beyond 2 years.",1,0,2020-9-22,1,0,0
"I should have paid more attention to reviews indicating Solo 5 supplements built in TV speakers with improved clarity, enhanced dialog but does nothing more ... no surround, no sub.  At this price point I'd encourage others to skip the Solo 5 and spend same $$ on a more feature rich system with same sound quality (LG, Visio).  Paying this money you're paying for the name and not a great sound experience. Solo 5 would be good for older folks to enhance their standard TV speakers but I can't think anyone else will be satisfied with Solo 5.  Other Bose products I own are great ... this is not,",2,0,2017-2-17,1,0,0
"Very crisp sound as Bose always has! The down fall is it’s not that loud especially on bluetooth. Can’t even tell a difference when pushing the bass button, I can’t tell if it’s on or off.",3,0,2018-12-14,1,0,0
"The sound quality cracks when there is a loud noise, absolutely terrible speaker.  As a lifetime Bose speaker buyer who expects a certain quality, I am incredibly disappointed with this product.",1,0,2019-12-1,1,1,0
"I got nice huge used tv but its speakers are really bad so I found this as my option and Wow I’m really impressed with its size and sound, it wasn’t too complicated to install it and its remote control with my tv as well, also its Bluetooth feature is awesome i can actually play music from my phone while I can enjoy my favorite Video on tv 👍🏼Gave 4* easy to use because it takes a bit to turn on the tv even though it’s connected with the tv",5,0,2018-12-2,1,0,1
supposed to separate voices from background.  NOT,1,0,2020-2-4,1,1,0
"Good for basic stereo sound, very minimal base, expected without dedicated subwoofer. I bought for $175 from local store and returned within 2 days because lack of depth of sound. Universal remote Worked well, and so did stand-by mode.",3,0,2017-8-13,1,1,0
Bose Solo 5.  I was surprised to find out that this soundbar is not compatible with RF remotes.  It uses old school IR and would not pair with my Dish remote.  I'm not going backwards and using a IR remote that I have to aim at my devices.  I prefer my old Vizio soundbar to this  one.  What's up with that Bose?,2,0,2020-5-10,1,0,0
It's nothing special and doesn't have enough power to fill even a small space. I returned mine.,1,0,2019-9-21,1,1,0
I repaced remote battery and system will not turn on or reboot. This is the first electronic merchandise that I purchased that broke after a short time period. Bose offers 1 year warranty then it costs $99 to service. I would stay away from this and look at something that has more of a shelf life. Never had issue wiht Bose before.,1,0,2020-4-14,1,0,0
"I received this speaker as a gift.  The quality is very poor.  It sounds washed out and only slightly better than the television.  I know it's cheap, but I still expect more from Bose.  If they can't make a good product at this price point, they shouldn't make one at all.",1,0,2018-12-19,1,1,0
"I didnt buy this on amazon, but as other shoppers i look at amazon to read reviews on a product before purchasing it.  This is great a soundbar! I looked at sony soundbars and after watching a few movies, I know i made the right decision purchasing this soundbar and the price is right. By the way it has a button to press to hear movie dialogue clearer and a button for added bass.  Bose has yet to disappoint me.  I just wanted to share, its awesome!",5,0,2017-4-15,1,0,0
I love the sound which is most important very clean and clear I wished it had an equalizer and also on the TV a sound level indicator but you can't have everything,5,0,2019-8-27,1,0,0
"Most of the reviews giving this product 5 stars are comparing it to the speakers on their flat screen which are mediocre. I purchased this from Costco because it was on sale but I already had the Samsung Sound Bar k450 and thought the Bose was superior just going off the name. I played the Bose speaker and thoroughly disappointed. I had two previous Bose products, the QC25 headphones and the sound dock from 2009, both were incredible products but this was just underwhelming.I stacked the speakers on top of each other and played the same songs to compare and the Samsung K450 blew away the Bose Solo 5, got completely boat raced, wasn't even a competition. My Samsung I purchased on sale after Black Friday for $150 and the Bose retails do $250, I found it at Costco for $220 and thought I was getting a steal, I wasn't. If your in the market for a sound bar go with the Samsung K450 or the k550. The Bose headphones and sound docks are awesome but they need more work on their sound bars.",2,0,2016-12-17,1,0,0
"To say this right up front, this isn't the most amazing sounding sound bar out there. It lacks the thump of systems having a dedicated subwoofer, and you won't get the same level of sound quality as, say, the $600Rather, this speaker system is a nice, compact, way-better-than-your-TV-speakers sound system that's better suited to watching the late night talk shows and news reports than hearing the cinematic explosions of a blockbuster action flick. We find it perfect for enhancing a small, wall-mounted TV in the bedroom, or streaming Bluetooth when relaxing on the mattress.",4,0,2016-4-18,1,1,0
Simple as can be. Hooked it up and turned it on. Remote is HUGE! But does the job. Plan to wall mount it soon.,5,0,2019-12-25,1,0,0
