comment,stars,verified,date,country,helpful,has-media
Crap box came taped to hell missing 3 reams of paper....... wish I could give it negative star rating,1,1,2018-10-31,1,1,0
Would buy again,5,1,2020-7-14,1,0,0
We continue to order this paper for our business as it is priced great and the quality is excellent.,5,1,2019-10-7,1,0,0
It is a very good paper.,5,1,2020-5-11,1,0,0
Works great!,5,1,2018-9-6,1,0,0
We bought 2 boxes of this and can't even use it. Very thin and wrinkled.. lines on the pages.. this paper is trash,1,1,2019-11-21,1,0,0
Good price.  Easy transaction.,5,1,2018-6-13,1,0,0
Copy Paper packaging was all torn up and open.,1,1,2020-8-29,1,0,0
I have used this paper before and it seems to have the necessary quality for my uses.,4,1,2018-4-30,1,0,0
This one ream of paper came in a HUGE box and the paper was all apart!,1,1,2016-12-7,1,1,0
Good quality and value,5,1,2020-7-21,1,0,0
Great service great quality paper. I will reorder recommended for everyone,5,1,2019-11-26,1,0,0
Good copy paper,5,1,2019-1-10,1,0,0
Great,5,1,2019-6-22,1,0,0
best deal for ur buck,5,1,2018-7-14,1,0,0
excellent product for the office,5,1,2018-5-17,1,0,0
"I am very pleased with Hammermill Paper and have been using it for years in my practice. I am so happy I can have it delivered to my door. I am saving on gas, time and energy.",5,1,2018-7-3,1,0,0
Liked everything about it - was heavy but that's what you get when you order that much paper.,5,1,2019-12-19,1,0,0
Value,5,1,2019-6-26,1,0,0
Good product... we buy this consistently for the office,5,1,2019-6-25,1,0,0
Best printer paper around.,5,1,2020-1-19,1,0,0
Never have a problem with printer jamming,5,1,2018-9-28,1,0,0
"Good quality, good price!",5,1,2018-11-9,1,0,0
"As a church secretary, I go through quite a bit of copy paper. I found this paper to be of high quality and would highly recommend it.",5,1,2019-8-4,1,0,0
works great!,5,1,2018-8-7,1,0,0
"What a savings in time and money!  I took the nerve of ordering Hammermill Copy Paper by the case, and I am so happy I did.  I use so much paper I was always afraid of running out and was buying locally 500 sheets at a time; then all of a sudden it was 400 sheets at the same price. By ordering from Amazon this way I get better paper for less money.",5,1,2016-6-30,1,6,0
"Our company orders ~20,000 sheets several times a year and even though Hammermill claims 20 lb, 92 brightness it's see through and significantly thinner than other brands that also say 20 lb, 92 brightness. I won't be ordering from them anymore.",1,1,2017-12-8,1,1,0
It’s Paper!,5,1,2020-6-24,1,0,0
"Great paper,great price, gets the job done with quality !",5,1,2018-3-20,1,0,0
Great value and pricing.  Goodbye over priced Staples..,5,1,2019-3-29,1,0,0
Perfect didn't have to go to store.,5,1,2018-5-4,1,0,0
A+,5,1,2019-1-7,1,0,0
Quality copy paper for a reasonable price!,5,1,2018-3-2,1,0,0
"Maybe it's just me, or I am unknowingly used to a heavier paper maybe, but these 20lb sheets seem awfully thin.",4,1,2019-12-24,1,0,0
We use 20lb paper for our business and this is NOT 20lb .It is thin and see through. W You can't pront back and front.,1,1,2020-5-11,1,0,0
Good price fast delivery,5,1,2020-2-24,1,0,0
A+,5,1,2019-8-19,1,0,0
Great. As advertised.,5,1,2019-6-19,1,0,0
I paid for a ten ream box and only nine reams came. I see no contact info for the seller and would liek to know how to request my tenth ream.,1,1,2020-4-7,1,0,0
great buy on copy papere,5,1,2018-5-23,1,0,0
Great quality and fast shipping,5,1,2018-9-7,1,0,0
This was a good buy with the great price.,5,1,2018-3-21,1,0,0
good product,5,1,2019-4-30,1,0,0
Small package for paper.,5,1,2018-7-30,1,0,0
We Opened 2 Reams of the paper and have baby roaches running everywhere!  Hammermill says Amazon is responsible for the packaging?,1,1,2020-8-31,1,0,1
It says this is 20lb. but it is clearly MUCH thinner than other 20lb. paper and jams my printer.Note to self... do not buy this paper again.,1,1,2019-11-11,1,0,0
Hammermill paper was shipped in substandard non Hammermill box and half of the paper was busted open from it's plastic seal.,1,1,2019-2-19,1,1,0
Good paper for at home printing.  No issues with jamming.,5,1,2018-3-14,1,0,0
It is not good,2,1,2019-5-18,1,0,1
For the price this is good paper. The only problem I've had is that it will stick together sometimes when being pulled through the printer tray.,4,1,2016-6-5,1,0,0
used as copy paper,5,1,2020-1-8,1,0,0
great quality paper,5,1,2018-5-17,1,0,0
I recommend it.,4,1,2018-10-6,1,0,1
Great Paper - bought this for my office. works well and the price was awesome. Couldn't pass up!,5,1,2017-5-26,1,0,0
Perfect. Great price. Great paper.,5,1,2018-2-7,1,0,0
"This paper came in a dilapidated box, no paper box, with reams split open and paper floating freely in the box.  This is not cool really as this is for my office and I can't store loose paper like this.  Seriously disappointed,",1,1,2018-4-20,1,1,1
Was shipped just fine!,4,1,2019-1-15,1,0,0
good product,4,1,2018-6-10,1,0,0
"This Hammermill Paper is very thin, not good for both size printing and constantly jamming my printer which I have no issue with the previous brand.",2,1,2019-2-15,1,0,0
All good.,5,1,2018-12-13,1,0,0
👍,5,1,2019-1-17,1,0,0
Great value! Thanks!,5,1,2018-10-5,1,0,0
"paper, what can i say. it works great and doesn't get stuck in my printer.",5,1,2018-6-25,1,0,0
Excellent paper quality,5,1,2019-4-17,1,0,0
Really nice weight paper. Pure white and it does not jam.,5,1,2018-4-17,1,0,0
Price effective and good quality. I receive this copy papers as recurring order. Goood!!,5,1,2020-9-18,1,0,0
good,5,1,2018-12-28,1,0,0
"I order this paper over and over. It is good quality, doesn't jam up in our printers, and produces a good copy.",5,1,2019-5-31,1,0,0
crisp paper,4,1,2018-6-14,1,0,0
Just fine for everything that you need to do at home,4,1,2017-4-16,1,1,0
Good quality,5,1,2018-11-28,1,0,0
Great. And well protected.,5,1,2018-3-24,1,0,0
Right when I needed it.,5,1,2018-4-13,1,0,0
"This paper never jams up, great for printing professional documents as well as images. This is the only paper I buy when I have a choice!",5,1,2016-12-30,1,0,0
"I like it, it’s very cheap.",5,1,2020-9-24,1,0,1
"This is not as heavy as the last paper I bought, and that's fine, I love printing stuff and it will take up less room!",5,1,2018-7-24,1,0,0
Lots of paper for the price,5,1,2020-1-25,1,0,0
This is nice paper for daily projects.  We will order again.,5,1,2017-10-1,1,0,0
It does the job at a very reasonable price.,5,1,2020-1-14,1,0,0
Good quality paper at a good price.  It performs as expected.,5,1,2020-10-2,1,0,0
Good,5,1,2018-6-22,1,0,0
OK,5,1,2018-7-2,1,0,0
Used for business and home - good value,5,1,2019-7-20,1,0,0
Great paper. We go through a lot at our office and always use this because of the fast delivery and great $$.,4,1,2020-4-17,1,0,0
Printing school papers,5,1,2020-2-11,1,0,0
It's paper!,5,1,2018-5-15,1,0,0
"As always, it is good dependable paper with very little paper dust.",5,1,2017-11-12,1,0,0
as described,5,1,2020-7-5,1,0,0
good product good price on time what else could you want?,5,1,2018-6-26,1,0,0
"I took a chance and purchased the ""like new"" box as it said it was in the original wrapping  There were only 7 reams of paper, not 8 and I paid nearly full price.  Will not purchase ""like new"" in the future.",3,1,2018-9-13,1,0,0
As expected,5,1,2018-5-30,1,0,0
It's working just great in my Canon inkjet printer. I print a lot of Ggogle Maps to get around New York City. Can't beat it at this price! Whee!,5,1,2015-5-10,1,1,0
Worth it,5,1,2020-3-5,1,0,0
Good Item,5,1,2018-6-4,1,0,0
"Very good item,Fast Ship,",5,1,2018-3-13,1,0,0
Bought this for our company's HP color printer.  The price made this purchase a great value.  Package arrived in excellent condition.,5,1,2016-5-22,1,0,0
USe this at work and buy it biweekly from amazon !,5,1,2018-9-16,1,0,0
This paper is so thin it gets stuck in the printer constantly.  Not worth the time it takes to have to keep fixing paper jams.,1,1,2020-1-6,1,0,0
"Good quality, and not terribly expensive.",4,1,2018-5-28,1,0,0
Great.,5,1,2018-8-8,1,0,0
"Good supplier fast delivery great product as described, recommended!!!!!",5,1,2017-9-6,1,0,0
It’s paper LOL. It’s our go to in our office.,5,1,2018-4-17,1,0,0
"Package was cut and taped over, every ream sliced, packaged and shipped that way, too heavy to return, RIP OFF",1,1,2020-4-4,1,0,0
Great price and value,5,1,2018-11-27,1,0,0
Love it!,5,1,2018-9-30,1,0,0
The price and quality are both good.,5,1,2020-6-30,1,0,0
Great for every day use.,5,1,2018-11-28,1,0,0
Great buy for the price. Good quality paper.,5,1,2017-11-22,1,0,0
Great quality and price.  Having it delivered is great.,5,1,2019-12-24,1,0,0
"The product was good, but during delivery process, quite a bit if the paper was damaged and couldn’t be used for printing",2,1,2019-12-27,1,0,0
Couldn't believe how incredibly difficult and costly it was to try to find a single ream of legal-size paper.  This is high-quality paper and it appeared almost immediately after I clicked 'order!',5,1,2014-9-8,1,0,0
Good value but every ream of paper was unsealed on the end.  Odd.  Paper seems fine.,4,1,2017-4-24,1,0,0
Seemed like good heavy paper,5,1,2018-10-23,1,0,0
"Good price, good paper.",4,1,2018-4-19,1,0,0
I have used Hammermill copy paper for years and have NEVER had a problem!!!,5,1,2017-9-27,1,0,0
Great value,5,1,2020-3-1,1,0,0
so far the paper is fine,4,1,2019-4-17,1,0,0
A very high quality paper for my home printer. I do not like to go out shopping so I order my office supplies from Amazon and get sometimes a better price! This is a good affordable paper choice.,5,1,2014-8-28,1,0,0
Excellent value!,5,1,2018-4-2,1,0,0
Perfect.  My husband and I both use it in our printers.,5,1,2017-9-3,1,0,0
"Works just fine, no paper jams.",5,1,2020-7-22,1,0,0
So flimsy.,1,1,2020-3-16,1,0,0
Quality paper,5,1,2019-2-1,1,0,0
Just what I needed in my office for an exceptional price!,5,1,2019-12-6,1,0,0
Works well in my laser printer/copier. Got it on sale for a good price. It is listed as a 92 brightness but appears brighter. Good product.,5,1,2019-5-28,1,0,0
very good quality,5,1,2019-6-10,1,0,0
Quality and priced right,5,1,2018-9-13,1,0,0
"Happy with this product, I will order again.",5,1,2020-1-24,1,0,0
Fast delivery great price,5,1,2018-9-8,1,0,0
Great for my office,5,1,2018-2-20,1,0,0
I had to order it because there was no time to wait at the office for the actual delivery of paper,5,1,2020-3-10,1,0,0
Worth every penny,5,1,2020-7-20,1,0,0
fair,5,1,2019-5-1,1,0,0
a good product,4,1,2018-10-28,1,0,0
Good,4,1,2018-12-9,1,0,0
"I would have given 5 stars but delivery note said ""handed to receptionist"" while in fact dumped at the entrance to the multi floor office building so almost got lost.",4,1,2019-5-23,1,0,0
I didnt have to drive to the store and the price was great so why not?,5,1,2017-5-17,1,0,0
poor quality paper,1,1,2020-5-6,1,0,0
"Great buy, especially the price.  Good quality paper. Purchased a case.",5,1,2017-11-3,1,0,0
Good paper.  No problems.,5,1,2018-1-21,1,0,0
GREAT,5,1,2018-4-29,1,0,0
much stronger than previous hangers I had.,5,1,2020-3-6,1,0,0
Very thin. Not what was expected.,1,1,2019-5-22,1,0,0
Good value for the money.,5,1,2020-8-29,1,0,0
good deal,4,1,2018-4-9,1,0,0
Box came to us all banged up and torn!,1,1,2018-3-28,1,1,0
"You can use it well, the thickness of the paper is appropriate, affordable, easy to use, and easy to buy.",4,1,2020-6-21,1,0,0
I don't have a car and needed printer paper.  It was nice to get good quality paper at a decent price delivered to my home.,5,1,2015-6-21,1,1,0
Good,5,1,2018-4-23,1,0,0
"Always consistent, always reliable. We have been ordering this paper for years and we will continue to do so as long as our company is in operation.",5,1,2019-7-23,1,0,0
Special price was great,5,1,2020-2-1,1,0,0
works,5,1,2018-4-11,1,0,0
Item as described,5,1,2020-8-10,1,0,0
Quality product with fewer jams.,5,1,2019-3-10,1,0,0
Paper is exactly as ad says EXCEPT the random glue together sheets cause the copier to jam.  I will not buy this paper again.,1,1,2020-1-7,1,0,0
Worst paper gets jammed by far horrible quality! Can’t even get my money back don’t buy!,1,1,2020-9-5,1,0,0
does the job,4,1,2018-3-1,1,0,0
"The package came on time. The smaller box have some sign of opening. The paper is not too bright, good with the price.",4,1,2020-5-18,1,0,1
"Fast shipping, great product. We will order again",5,1,2018-2-19,1,0,0
"Only use this brand - differently no jamming.  Only problem is the boxes usually are beat up and sometimes broken on the side,",5,1,2016-9-2,1,0,0
As expected.,5,1,2018-3-14,1,0,0
This paper manufacturing has good products and delivery was very prompt,5,1,2019-1-5,1,0,0
Great supply and delivered promptly,5,1,2017-11-5,1,0,0
GOOD PRODUCT FOR PRINTING,5,1,2018-5-1,1,0,0
Great,5,1,2018-10-6,1,0,0
It was very much like paper. Perfect for our paper needs.,5,1,2018-1-8,1,0,0
came quick and what I wanted,5,1,2017-11-15,1,0,0
"Paper seems thin compared to other printing paper, but is affordable to the point where it is worth it.",5,1,2015-3-26,1,2,0
Excellent value for the price! The paper works great in my HP printer for everyday use. Highly recommended.,5,1,2016-8-3,1,0,0
Came in quick and great paper Al’Hamdulillah,5,1,2020-9-1,1,0,0
"I have been using Hammermill copy paper for over 6 years. The quality of this box of paper is extremely low. Also, for the first time, I have never seen such a low quality wrapping paper.",1,1,2019-5-15,1,0,0
Great value! Good quality..prints well.,5,1,2020-6-8,1,0,0
As described,5,1,2018-3-30,1,0,0
good quality,5,1,2018-4-10,1,0,0
I have ordered this before and it has been a HUGE issue getting it delivered. I will not be ordering this product again.,1,1,2019-12-31,1,0,0
Excellent,5,1,2018-10-28,1,0,0
Great product.,5,1,2018-2-20,1,0,0
"Great value, great paper.",5,1,2017-11-25,1,0,0
only one I use,5,1,2018-2-9,1,0,0
"As advertised, good quality.",5,1,2017-10-30,1,0,0
What else is there to say about Hammermill paper.  It's been around forever for a reason.  Great quality.  Great packaging. Can't go wrong.,5,1,2015-10-27,1,0,0
"This paper has worked great in my classroom. I'm able to print without jams and the paper is bright, easy to read.",4,1,2018-4-1,1,0,0
Shipped fast and no reams were ruined.,5,1,2019-9-18,1,0,0
paper quality is good.,5,1,2019-7-16,1,0,0
Received box damaged and taped missing a ream of paper. Not too happy.,1,1,2017-10-21,1,1,0
good quality hammermill paper,5,1,2020-5-1,1,0,0
Did not arrive as advertised.,1,1,2017-11-22,1,0,0
Thanks.,5,1,2018-2-28,1,0,0
Everything was on point! Great quality @ a great price!,5,1,2019-8-18,1,0,0
Thank you,4,1,2018-5-24,1,0,0
Good,5,1,2018-3-13,1,0,0
Great value for the amount of paper my office uses,5,1,2019-4-18,1,0,0
Great,5,1,2018-3-26,1,0,0
Happy with product!,5,1,2019-2-19,1,0,0
works great,5,1,2018-2-9,1,0,0
Great price.,5,1,2018-3-22,1,0,0
Paper really thin,2,1,2019-6-12,1,1,0
Nice printing paper,4,1,2018-5-2,1,0,0
Exactly as expected.,5,1,2017-12-7,1,0,0
Greaat,5,1,2019-8-23,1,0,0
Great product. Arrived super fast. Perfect packaging. Too bad I didn't check the capacities of my printer first. Ha!,5,1,2015-12-1,1,0,0
"thin paper, packaged poorly, some edges bent  from sliding around in the box. Okay for the price though, will probably order again.",4,1,2015-8-18,1,0,0
Good deal. Product is good quality.,5,1,2019-10-21,1,0,0
It's paper. It's white. There's a lot of it. Good price. What's not to love? Paper. It's what documents are made of.,5,1,2016-7-20,1,0,0
Works well,5,1,2017-11-11,1,0,0
Worst paper you could buy. Literally every 10th page would jam. Do not waste your money or time on this aggravation,1,1,2019-10-17,1,0,0
Very Good.,5,1,2017-12-27,1,0,0
Item arrived very quickly and was exactly as described.,5,1,2020-4-16,1,0,0
Great product,5,1,2017-10-23,1,0,0
"If you want a print then dispose paper then get this. quality of paper is so-so, not sure if this justifies its price.",3,1,2015-11-1,1,0,0
"Oddly, the paper did jam once when we first used it. Otherwise as advertised and suitable for everyday use.",4,1,2015-7-7,1,1,0
Very thin paper,2,1,2020-1-7,1,0,0
Awesome paper to date. No jamming and no smearing.,5,1,2019-3-10,1,0,0
Very few jambs like I was having before,5,1,2019-4-27,1,0,0
They left the box knowing that it was raining all the paper is wet,3,1,2020-5-24,1,0,0
Great buy,5,1,2017-12-29,1,0,0
Easy delivee,5,1,2019-11-18,1,0,0
"Prints well,  thickness appropriate & efficient delivery.",5,1,2019-12-10,1,0,0
Like my headline states: Good paper at a good price.,5,1,2019-12-17,1,0,0
Perfect for Laser Printer,5,1,2019-1-2,1,0,0
"The product itself is great. Have used it for a long time. It prints well, does not bring up more than one sheet and does not bleed when you use color.",5,1,2019-8-6,1,0,0
Good quality,5,1,2019-11-5,1,0,0
"I don't like the plastic wrapping, very hard to open",4,1,2017-5-17,1,0,0
The box was broken and the individual wrappers for the sheets were also torn. Not very happy.,1,1,2016-8-1,1,5,0
Great product and fast delivery...,5,1,2019-3-15,1,0,0
"Originally, I'd posted a negative review for this product and it's supplier.  Apparently when the item was posted, there was an error in the description - whether Amazon or the supplier was responsible remains a mystery.In any case, due to the mix-up, I was refunded the full amount (including shipping) and allowed to keep the product (1 ream) I was shipped.  I later received a call from the owner of TheNerds, offering an apology for the mixup.",5,1,2007-9-6,1,2,0
"Good price, great delivery!",4,1,2017-11-13,1,0,0
this is the only paper I use.Almost no paper jams--ever,5,1,2019-10-29,1,0,0
Too thin. Almost like tracing paper compared to other same pound papers,1,1,2020-2-19,1,0,0
"When I received this case of paper, not only was it busted and looked like it'd been through the ringer...there was a missing ream of paper.  I ordered 10 reams of paper, but only received 9.",1,1,2018-1-8,1,1,0
Great paper quality. Does not jam in my HP Laserjet printer.,5,1,2017-1-7,1,0,0
it makes It look like they are full cases these are only half cases  - false advertising,1,1,2020-7-20,1,0,0
Good,5,1,2020-2-23,1,0,0
Will take me a while to use up all that paper and the price was right.  Arrived safely and being used.,3,1,2016-3-7,1,0,0
great paper. very great.,5,1,2020-3-14,1,0,0
Always good paper!,4,1,2017-9-28,1,0,0
"If I were just rating the paper, 5 stars, however, the plastic wrapping on the outside is a pain in the butt to open sometimes.",4,1,2016-4-6,1,0,0
came in a timly fashion,5,1,2020-6-24,1,0,0
you have to make sure it does not stick together when printing,3,1,2017-4-9,1,0,0
Buena calidad,5,1,2020-5-28,1,0,0
Great paper at a great price.,5,1,2017-10-11,1,0,0
Printer,5,1,2019-5-4,1,0,0
Good price fast delivery,5,1,2017-10-18,1,0,0
Very fast delivery.  No problems at all!,5,1,2019-3-28,1,0,0
Great value.,5,1,2018-1-2,1,0,0
Paper is paper what more can I say.,5,1,2018-8-10,1,0,0
"Jams in our copy machine, but not real often.",4,1,2019-12-15,1,0,0
Great value and quality.,5,1,2018-1-11,1,0,0
I don't think I'll finish this much paper. Maybe I bought too much but it was cheap.,5,1,2019-12-16,1,0,0
"only 1 box of paper was delivered we had sent back 2 boxes for replacement, what happened to the other box?",1,1,2019-11-6,1,0,0
This paper is so thin that it jams in my printer.  The paper is not usable.,1,1,2020-10-2,1,0,0
I am very satisfied with this product. It arrived in time and properly packaged. I really do not have anything negative to say.,5,1,2019-2-9,1,0,0
"Arrived in damaged cartons, but the product works fine in the large office copy machine. Price was right too.",4,1,2015-12-15,1,0,0
Copy paper did not arrive as indicated. Epson Printer ink did arrive.,1,1,2019-3-8,1,0,0
great,5,1,2017-11-7,1,0,0
Good value and it was delivered..,5,1,2018-10-9,1,0,0
good copy paper,4,1,2017-9-30,1,0,0
paper is practically see through,3,1,2018-3-6,1,0,0
"Great product. Low dust, low jamming, great ink retention.",5,1,2016-12-29,1,0,0
The product came on time,5,1,2020-2-20,1,0,0
We've been using this paper for years and have been pleased.  It feeds into the printer/copier fine.  The paper has a clean bright look.,5,1,2018-2-21,1,0,0
"The paper was thrown in a big box, Quite a bit of the paper was bent and not useable except for scrap.",2,1,2016-9-22,1,0,0
good buy,3,1,2018-9-17,1,0,0
The copy paper reams were not shipped in original copy paper box and were incorrectly packed.One ream was broken open and is folded/crinkled so un-usable in copy machine. Would love to have ream replaced.,2,1,2018-10-1,1,0,0
great deal,5,1,2020-8-6,1,0,0
"Plan to start printing rough drafts of my manuscript, and send them to possible reviewers.  This is good sturdy work paper that doesn't cost top dollar.",5,1,2014-8-17,1,0,0
Great Product! Great Price! Happy Costumer!,5,1,2017-3-5,1,0,0
Pet value and a smart purchase,5,1,2020-6-21,1,0,0
Love Hammermill paper,5,1,2017-7-14,1,0,0
A+,5,1,2020-3-16,1,0,0
Paper - delivered via prime.  Awesome!,5,1,2017-8-18,1,0,0
printing,5,1,2019-11-6,1,0,0
Excellent value. It.s paper and it's inexpensive. I am not a paid reviewer.Bottom line: Buy it.,5,1,2016-7-23,1,0,0
Great price for the quantity,5,1,2019-11-24,1,0,0
Awesome Printing Paper! Highly recommend it!,5,1,2017-5-28,1,0,0
Good Price,5,1,2018-7-25,1,0,0
Very nice and it came very fast to my house,5,1,2020-6-12,1,0,0
"im sure its good, but we needed the 8.5 x 11",5,1,2017-2-9,1,0,0
There were only 6 reams of paper in the box when it arrived.,1,1,2016-2-25,1,1,0
Great paper. It doesn't jam.,5,1,2017-4-24,1,0,0
as advertised,5,1,2017-7-31,1,0,0
Great!,5,1,2018-7-18,1,0,0
High quality paper for every purpose.  A little pricey.,5,1,2015-12-19,1,1,0
Excellent value.,5,1,2018-1-30,1,0,0
nice,5,1,2017-9-5,1,0,0
The paper quality is fantastic.,5,1,2017-11-8,1,0,0
"Cheap and very high quality, plus Amazon Prime shipping on it. Cant beat it!",5,1,2016-5-31,1,0,0
Excellent Value,5,1,2017-6-27,1,0,0
Excellent Product.,5,1,2017-7-18,1,0,0
Always a great printer paper.,5,1,2017-8-12,1,0,0
Great deal,5,1,2018-8-23,1,0,0
Very good product,5,1,2019-11-7,1,0,0
nice,5,1,2018-3-27,1,0,0
"I dislike that I was missing a ream of paper, this is not cheap",1,1,2020-9-15,1,0,0
good copy paper,5,1,2018-7-6,1,0,0
Good quality.,5,1,2019-8-7,1,0,0
Great for everyday printing!,5,1,2019-2-25,1,0,0
good value decent papers,4,1,2019-6-17,1,0,0
As expected,5,1,2017-11-8,1,0,0
This product arrived with two reem's of paper missing.  I wrote a review and was not contacted back. Very disappointed.,1,1,2018-7-19,1,1,0
It's paper. Bought this for a remote work site.,5,1,2016-12-3,1,0,0
A lot of paper for the money,5,1,2018-1-2,1,0,0
Product seems great but was delivered to the business address after hours and left in the rain,1,1,2018-8-22,1,1,0
"I have been using this paper for month, good quality no complains.",5,1,2019-6-24,1,0,0
Works well for my needs!,4,1,2020-2-17,1,0,0
Thanks!  Came quickly & as advertised! 5-star,5,1,2017-9-24,1,0,0
prints well,5,1,2019-10-29,1,0,0
Just as promised,5,1,2017-5-27,1,0,0
Quality of paper meets my needs very well.,5,1,2020-9-2,1,0,0
Does not scan very well,2,1,2019-8-29,1,0,0
I feel the printer works better with staples brand paper,3,1,2016-9-2,1,0,0
I got what I wanted,5,1,2019-11-6,1,0,0
We have bought this product before. However this time the paper is much thinner and almost transparent.,2,1,2019-10-24,1,0,0
We love the brightness and quality of this Hammermill Paper.  The shipment came exactly when expected.,5,1,2019-2-28,1,0,0
"When delivered, each package was torn up.  Some of the paper corners were folded over",2,1,2020-1-6,1,0,0
Great products...,5,1,2017-7-20,1,0,0
The paper is doing the job although the occasional page sticks in the printer. Overall I am very satisfied.,4,1,2019-8-2,1,0,0
I have used this brand before and like the paper quality. I will buy this product often also it truly doesn't jam the printer.,5,1,2014-2-11,1,1,0
"When I received the item, the box was broken and the paper packaging inside every single ream of paper have tears on them.",3,1,2019-7-28,1,0,0
"good paper, delivered double wrapped (2 boxes)which is great",4,1,2016-7-14,1,0,0
Good paper for the price,5,1,2020-9-16,1,0,0
Excellent for printing,5,1,2020-1-29,1,0,0
Very happy with this product. The paper is a nice weight and runs smoothly through our printers.  We will continue to use the Hammermill copy paper.,5,1,2019-3-28,1,0,0
Definitely worth the money!  Works fine and have had no issues.,5,1,2019-9-27,1,0,0
perfect as described - great price and good deal. thanks!,5,1,2016-7-18,1,0,0
I like this copy paper very much. It works better in my inexpensive copier than most other papers I have tried.,5,1,2015-5-8,1,0,0
"Weight of paper has changed, very lightweight and wrinkles easily",2,1,2019-5-21,1,0,0
I love this paper. It's all I buy,5,1,2019-10-8,1,0,0
"WORST PAPER EVER, DO NOT ORDER!!",1,1,2019-12-4,1,0,0
Good product,5,1,2020-1-2,1,0,0
Great for the price.,3,1,2019-8-16,1,0,0
Good deal and prompt delivery,5,1,2018-9-17,1,0,0
Disappointed that only 2 of the 10 reams arrived for this box.Box was altered.,1,1,2020-2-7,1,0,1
What I expected.,4,1,2017-4-7,1,0,0
Exactly as described and pictured. Shipped in tact. Will order again.,5,1,2016-3-30,1,0,0
"Just as expected, thank you.",5,1,2017-11-18,1,0,0
Great product.  Great price.,5,1,2017-1-19,1,0,0
good quality and doesn't jam the copier,5,1,2018-3-28,1,0,0
Great Product,5,1,2017-7-27,1,0,0
