comment,stars,verified,date,country,helpful,has-media
"It’s paper, what more can I say? Well, we can start with the fact that it’s super thin paper. Inkjet shows through it. Not good. Never had that problem with 20lb paper before. Otherwise, it’s paper. You print on it, write on it, whatever.",3,1,2019-12-26,1,0,0
Great paper,5,1,2020-6-27,1,0,0
Perfect for what we need.,5,1,2020-1-16,1,0,0
Prints well,4,1,2020-4-25,1,0,0
Liked it,5,1,2020-4-1,1,0,0
"Price was better than others and it isn't flimsy, like some less expensive copy paper.  Good value!",5,1,2019-4-4,1,0,0
:),5,1,2020-5-4,1,0,0
Still use this same pack,5,1,2020-2-28,1,0,0
Great paper.,5,1,2020-4-22,1,0,0
works well in my printer,5,1,2020-7-16,1,0,0
I’m pleased with my purchase.,5,1,2020-2-5,1,0,0
Awesome for kids to drw.,5,1,2020-6-4,1,0,0
Good quality and value,5,1,2020-6-12,1,0,0
"good price, good quality.",5,1,2020-2-20,1,0,0
"Was supposed to be a 10 ream case, I only received 2 reams when I paid for 10.",1,1,2016-11-16,1,8,0
"Good paper, no issues",5,1,2020-2-25,1,0,0
Great price.,5,1,2020-4-18,1,0,0
The paper is so thin that when we print on both sides it's easy to see the picture or text on the other side. Not recommended. They’re even worse than the paper produced by the large supermarket whose name begins with W.,3,1,2020-8-16,1,0,0
It's paper. Not much to say,5,1,2020-2-23,1,0,0
Boxes and reams were severely damaged.,1,1,2018-12-5,1,1,0
"Was not delivered with the Suite, was dropped of in the Main Lobby of our building.  Not happy with the delivery, everything else was fine.",1,1,2019-11-18,1,0,0
a,5,1,2020-9-19,1,0,0
Both boxes were damaged and every ream was torn open. This was most likely done by the company that delivered it. The actual paper was fine. Only a few sheets were damaged. Just wanted to let you know.,4,1,2019-5-17,1,0,0
Great deal for the price. Plus free shipping 👍,5,1,2019-11-15,1,0,0
Great value for paper,5,1,2020-4-13,1,0,0
It’s very good quality paper and it’s very cheap compare to retail stores.  I got it very fast.,5,1,2020-9-19,1,0,0
Good paper - good price,5,1,2020-2-10,1,0,0
",jnkjbkhgjvgcghc",5,1,2020-5-26,1,0,0
Great product,5,1,2020-7-25,1,0,0
I was in the middle of printing when I had to put in this paper after having used another brand.  This paper is way more off-white than the last paper that I had.  I also is kind of wavy looking or something.  I will not buy this paper again for business purposes.,3,1,2020-2-3,1,0,0
Great value for modest amount of paper.,5,1,2020-1-9,1,0,0
"As described, fast shipper...",5,1,2020-6-14,1,0,0
What's to say? It's good paper!,5,1,2020-5-23,1,0,0
Excellent buy. 5 stars. No complaints.,5,1,2019-12-17,1,0,0
"When I opened my box of ten reams of paper, all of the reams were ripped opened!  Why are the reams paper wrapping ripped open?  I do not need paper that has already been opened.  This product will be returned.",1,1,2018-2-6,1,1,1
Happy to find a decent amount of good quality paper for a great price! Will be purchasing again!,5,1,2019-7-27,1,0,0
Excellent quality paper. Will definitely but again when needed.,5,1,2020-5-29,1,0,0
"These reams were ordered for use in the office I work in but would be great for home use also.  As copy paper goes, this is good quality.",4,1,2018-9-4,1,0,0
It works,5,1,2020-8-21,1,0,0
"Great Paper, Value for the money",5,1,2019-12-13,1,0,0
Excellent value and product. Highly recommend Hammermill.,5,1,2020-1-13,1,0,0
love this item..DONT like that the delivery of this heavy boxe is left in the mail room of the building downstairs that our business is in..this need to come to our door!!!!!  that is the reason we started to order online so that i dont have to carry into our office..,1,1,2020-8-6,1,0,0
"This arrived today and seems to be the same paper as the ""poly wrap"" paper--but each ream is wrapped in paper, not a poly wrap. A minor quibble, but the fact about this particular box of reams. All in all, I've been very pleased with this printer paper and hope that the paper-wrapped reams are otherwise identical to the poly-wrapped reams. Thank you for very prompt delivery!! :)",4,1,2017-1-31,1,7,0
Fair price for a very good product,5,1,2019-12-2,1,0,0
I am happy with this purchase. It seems to be average quality for a GREAT price !I will be buying that again.,5,1,2018-12-10,1,0,0
Great,5,1,2020-9-26,1,0,0
2 full reams of paper is completely unusable because it was torn and folded so bad. It was covered up by paper that was good which leads me to believe it was on purpose. I would not reccomend this product.,1,1,2018-11-10,1,1,1
The paper quality is OK and it was delivered quickly but it is very expensive.,3,1,2019-8-4,1,0,0
IT arrived quick and it was a good bargain,5,1,2019-12-13,1,0,0
Nice paper at reasonable price,5,1,2019-12-16,1,0,0
as described,5,1,2020-6-10,1,0,0
Good deal,5,1,2020-7-2,1,0,0
"The individual reams of paper ordered were open, ripped and torn, and tossed into another larger box. The larger outer box was torn and wrapped in tape.  All paper was wrinkled, torn, loose or otherwise destroyed and completely unusable.",1,1,2020-7-24,1,0,1
Its paper I like it,5,1,2020-6-14,1,0,0
it was worth the money,5,1,2020-6-21,1,0,0
⭐️⭐️⭐️,4,1,2020-8-17,1,0,0
"This paper actually isn't bad, priced pretty fair and brightness and quality of the paper is just like other leading name brands. Might not be a name brand like HP but the quality is pretty comparable.",5,1,2015-10-7,1,3,0
Hammermill Copy Plus works perfectly in my Brother duplex printer.  Hammermill Copy doesn't get picked up or detected and if I vary the amount of paper maybe it picks it up.  The print is then super-light.  I now have 8 reams of scratch paper.,1,1,2019-10-23,1,0,0
The quality is disappointing.  It doesn’t feed well through our printer.,5,1,2019-7-9,1,0,0
Paper quality is very good.  Nice to have enough printing paper on hand.,5,1,2020-10-4,1,0,0
It is good products,5,1,2020-4-16,1,0,0
It is good paper and works well in the printer.,5,1,2020-7-26,1,0,0
this was a lot smaller than I thought I was getting,2,1,2018-7-30,1,1,0
I PURCHASED THIS PRODUCT FOR OUR MEDICAL OFFICE. ONCE WE STARTED OPENING THE REAMS IT TURNS OUT ALMOST EVERY OTHER PAGE HAS A LINE RIGHT DOWN THE MIDDLE AND THE PAPER RIPS RIGHT ALONG THAT LINE! WE HAVE HAD TO GO THROUGH THE STACKS OF PAPER TO TAKE OUT THE ONES WITH THE LINES AND MAJORITY OF THE BOX IS NOW USELESS TO OUR PRINTING NEEDS! AND NOT WASTING OUR TIME MAILING IT BACK! WE SHOULD GET A REFUND OF THIS PRODUCT!!,1,1,2018-12-18,1,0,0
Great paper,5,1,2020-7-6,1,0,0
"Pretty standard paper, does its job, got a lot for the right price, like it!",5,1,2019-9-12,1,0,0
The paper is very different than the ones I ordered before. No idea why. It is thinner and it is of low quality.,1,1,2020-2-28,1,1,0
Excellent. Arrived timely. Works.,5,1,2019-11-28,1,0,0
It’s paper brought to your door what’s not to like?,5,1,2019-12-13,1,0,0
Great product,5,1,2020-5-25,1,0,0
Great value for the money. Paper is not to thin,5,1,2020-1-6,1,0,0
It prints clearly and well and flows from printer with ease.,5,1,2019-12-31,1,0,0
"This order arrived and had gotten wet even though we typically like this product . Would appreciate a replacement , as our other order  was fine. The paper was an issue .thank you",1,1,2019-12-2,1,0,0
Good Value,4,1,2020-3-3,1,0,0
Works well in my printer and is not thick.  My daughter happened to buy a different pack which is a thicker stock and I think I prefer this paper to the thicker one for everyday use.,4,1,2015-11-17,1,3,0
Value for money,5,1,2020-6-27,1,0,0
Perfect for printing and copying,5,1,2019-12-2,1,0,0
Qualiry,5,1,2020-7-24,1,0,0
"This paper works fine in the printer, has not caused any jams, quality is good for general office use",5,1,2020-3-16,1,0,0
n/a,4,1,2020-2-24,1,0,0
I love that I will never run out of paper,5,1,2019-9-29,1,0,0
"The paper is bright white, jam free, and comes out of the printer completely as expected.",5,1,2019-3-25,1,0,0
Very good as expected,5,1,2019-12-9,1,0,0
Good paper.,5,1,2020-8-23,1,0,0
AWESOME!,5,1,2020-6-4,1,0,0
Good paper,5,1,2020-1-22,1,0,0
Always use this brand!,5,1,2020-1-19,1,0,0
Paper. Lots of it. No lines. It’s great.,5,1,2019-10-23,1,0,0
Great for printers and basic documents,5,1,2019-10-16,1,0,0
Good Product,5,1,2020-6-19,1,0,0
"got it delivered 2 days and it was good price.besides those two details, it is copy paper.",5,1,2020-4-20,1,0,0
Quality of paper is good for the cost.,5,1,2020-1-9,1,0,0
"Product is fine, but the wrap job was horrid, crushed, and hugely oversized. Inside box of reams was fine.",5,1,2019-10-28,1,0,0
Does what it's intended purpose is,5,1,2020-3-4,1,0,0
"the paper quality is bad, it feels softer than it should be and whenever I print something itlooks like the ink is smudged. my printer did not do this before. but this paper is affordable.",2,1,2019-11-12,1,0,0
Perfect for our home office use,5,1,2019-12-15,1,0,0
Quality good. Price slightly high.,4,1,2020-1-11,1,0,0
Good Product.  Great value for the money!  Will order again soon.,5,1,2019-6-6,1,0,0
"This is not what I expected.  It is not Copy Plus, which is what I wanted.  Still it's a quality Hammermill product and works very well and the price was excellent.",4,1,2018-4-6,1,0,0
"This is the thinnest copy paper despite its posted 20lb wght.  The quality is extremely poor. Unfortunately, I have a case of 8 reams and will have to use it until I can throw it out.",3,1,2019-11-20,1,0,0
"I ordered this for our office, we have not had any issues at all. Not too thin, not too thick.",5,1,2019-7-28,1,0,0
Thank you,5,1,2020-6-5,1,0,0
Excellent,5,1,2020-6-3,1,0,0
This paper is very thin and such poor quality that my printer is jamming because of it.  I normally order paper from WB Mason and I will definately not order this again.  The return window has closed so I'm stuck with a case of junk paper.  OMG don't order this stuff.,1,1,2020-8-12,1,0,0
"have purchased this for office numerous times- will always buy, great value. thanks",5,1,2019-11-18,1,0,0
Every piece.,5,1,2020-6-8,1,0,0
"Get this for my office, good value fast shipping",5,1,2019-7-30,1,0,0
It’s paper what else can I say !  Box arrived on time and in perfect condition !  Paper is just as advertised !,5,1,2018-10-22,1,0,0
Excellent Product and delivered promptly! I would gladly purchase again!!,5,1,2019-4-13,1,0,0
"Nice bright paper, not necessarily the easiest to get in to with the plastic wrap but still a nice product.",4,1,2017-10-30,1,1,0
"I am very happy with this, overall.",5,1,2019-9-22,1,0,0
good value for the price,5,1,2020-7-29,1,0,0
"good PAPER, JAM FREE",5,1,2020-1-6,1,0,0
The paper works well for me for loan signings.  There were a couple of reams that were damaged with delivery.  The buyer refunded me for them.  Will use this company again.  Thanks!,5,1,2020-5-1,1,0,0
"This is good paper at a good price.  The way my kids go through this stuff I wanted a good value but also quality paper, this was a perfect combination.",5,1,2018-3-20,1,0,0
Good Price.,5,1,2020-6-22,1,0,0
Very thin paper.,3,1,2019-12-10,1,0,0
"Just what I needed.  Works well, good quality.",5,1,2019-8-2,1,0,0
My husband was very happy with my purchase. The paper is very good quality. Very fast delivery too.,5,1,2020-5-12,1,0,0
"We have a home office and go through LOTS of copy paper. We always order Hammermill because we are confident of the quality, AND we always order through Amazon due to the simplicity of ordering and the quick delivery we know we'll receive.",5,1,2020-10-5,1,0,0
Amazing overall with no jams. Good quality.,5,1,2019-12-15,1,0,0
"This product was purchased to fulfill our home supply. Quality is excellent. Service, the best!",5,1,2020-4-21,1,0,0
"Perfect multi-purpose copy paper for my school work, paper is thin and doesn't jam on home printers.",4,1,2020-1-19,1,0,0
Perfect.,5,1,2020-1-23,1,0,0
Paper is light but is okay for a two sided print.,4,1,2020-8-18,1,0,0
"All paper that I have ever used in this printer has been fine with maybe 1 jam every few hundred sheets, but this paper gets jammed consistently every 10 pages or so.  What a waste of money - don't bother.",1,1,2020-2-1,1,0,0
"This is the worst paper I've ever used. I spent almost an hour trying to figure out what was wrong with my printer, it was this paper. Every single page, it jammed. I put my other paper in, not a single jam. DO NOT ORDER THIS!!!!",1,1,2020-8-14,1,0,0
great value and looks no one can beat it.,5,1,2019-12-5,1,0,0
Good value !,5,1,2019-12-9,1,0,0
Great for office,5,1,2020-6-12,1,0,0
"It's paper. Inexpensive, works just fine for printing.",5,1,2020-1-15,1,0,0
"This paper is advertised as 20lb copy paper, but when I opened it up, the paper is very thin, and not the same as the 20lb paper we have on stock.  Very thin and rolls up after running through the copy machine. Very disappointed...",1,1,2020-2-3,1,0,0
Works great,5,1,2020-3-3,1,0,0
"Paper jam free on samsung laser printer for 5 years now, works in our HP and Epson workforce pro for 6 months now without paper jams and dusty paper residue. The only paper I will use at home and the office.",5,1,2016-8-16,1,1,0
Front door delivery!  No paper jams!  This is the best paper I have ever used.  I am a lifetime customer now.,5,1,2018-11-11,1,0,0
"Great product, no complaints!",5,1,2020-1-28,1,0,0
Good quality printing paper at great price,5,1,2019-12-28,1,0,0
"We ordered this and only received 7 reams, 3 were missing from the box. It looked like the box had been opened then taped up excessively. I do not want to return it as we need the paper for the business but that is just disappointing, as well as a bit of a waste of money considering we did not receive it in full.",3,1,2019-11-1,1,0,0
Nice and bright! Good feel. No jamming.,5,1,2019-11-26,1,0,0
I don’t feel comefirtablr about them. They look so thin. My brother printer some time print draw 2 pages together because it’s so thin despite my printer is new one and I have no problem with it before. I don’t suggested for other.,1,1,2018-12-27,1,0,0
Good quality and price,5,1,2020-1-9,1,0,0
Definitely appears to be jam free - very good.,5,1,2019-8-12,1,0,0
"We have used Hammermill Copy Paper in the past,  and have been happy with the product for our busy office. Our last delivery has been giving us major paper jams- the individual paper sheets are not completely separated on one of the shorter edges, and there appears to be some water damage....although the box appears ok from the outside, as do the individual ream packages.",1,1,2019-3-30,1,0,0
Great way to get office supplies,5,1,2020-8-3,1,0,0
as described,5,1,2020-6-6,1,0,0
A very good product..,5,1,2019-10-28,1,0,0
Great product for the office and delivery too,5,1,2019-7-14,1,0,0
Good printer paper,5,1,2020-1-12,1,0,0
Great product for a great price! The paper is better quality than expected for such a great price! I use this paper in my office and love it!,5,1,2019-11-1,1,0,0
Came in handy while working from home during Covid-19,5,1,2020-5-11,1,0,0
Great USA product,5,1,2020-6-11,1,0,0
"the quality of this paper, it's really really bad.Some pages are bright white nice quality but most of the ream is pale yellow.",1,1,2019-5-15,1,1,0
"It's paper, not rocket science. Hammermill stuff is good, price was right, 1/2 case was right quantity, so everything was normal.",4,1,2018-6-3,1,0,0
"Nice feel to the paper, great value and quick shipping!! Can't ask for much more",5,1,2019-2-20,1,0,0
I got what I ordered and that's what I wanted; satisfied!*I suggest a heavier weighted paper if you intend to double-side print. The paper wrinkles and the text can be clearly seen through both sides.,5,1,2019-5-23,1,0,0
Great product!,5,1,2019-12-19,1,0,0
No issues with delivery or merchandise.  Thanks!,5,1,2019-8-19,1,0,0
"It’s paper. Good quality, meaning it’s pretty stiff and the print looks really really good on it. Don’t know what we had before but this is better.",5,1,2019-9-29,1,0,0
The paper is exactly what I expected at a good price.,5,1,2019-6-19,1,0,0
"This was to be delivered to our street address.  Not the PO Box.  I don't like picking up a 50lb box across the counter at the Post office, and then carry to my car. When you can't pick the PO box as a delivery address, it shouldn't be delivered there, nor would I want it to be.",5,1,2020-1-16,1,0,0
"MADE IN USA. Bought this paper to print out 2019 taxes. Runs good, MAGA!",5,1,2020-3-14,1,0,0
Probably not the best idea to have this shipped with other items.,5,1,2019-4-1,1,0,0
It’s perfect . Doesn’t jam my printer.,5,1,2019-11-13,1,0,0
It's paper it's white it works,5,1,2020-5-23,1,0,0
My printer never had a paper jam until I got this paper. I have to put one page in by one every-time I print something.,2,1,2018-7-19,1,0,0
"I buy this paper for office / small business use and have had a negative experience. We've used this supplier for quite some time with no problem, but recently have had an issue with black and brown flecks, and little detritus embedded in the paper itself. I just use this for cheap office copy paper, but have decided it is unacceptably poor quality for that application.",2,1,2019-2-11,1,0,0
The plus was being able to have it delivered to my front door.  Thanks.,5,1,2019-10-31,1,0,0
Good quality paper,5,1,2019-10-27,1,0,0
This paper jams about 25% of the time  Don’t believe what it says on the package or online take it from someone who goes through 2 cases Af paper a month  It’s horrible,1,1,2019-4-3,1,0,0
We only buy this paper for our home printer.,5,1,2019-6-27,1,0,0
"Lightweight, great quality paper.",5,1,2019-8-13,1,0,0
"Looking for printer  papers and some are too expensive, went to amazon and got his paper for a good price and it was delivered fast. The quality of papers is also great, it will last me a long time.",5,1,2020-9-30,1,0,0
Best for Money,5,1,2019-11-28,1,0,0
I ordered a case of paper and one of the reams was severely damaged.  The rest of the reams of paper are perfect. I would like to return the one that is damaged for one that isn't but that doesn't seem to be an option. I don't want to box up the entire case and return it for just one ream of paper.,3,1,2019-10-23,1,0,0
"Yup, it's standard copy paper.",5,1,2019-7-18,1,0,0
Good quality paper and competitive price.  The quickness of the delivery was a real plus too!,5,1,2019-1-15,1,0,0
Great value. Delivered directly to my door.,5,1,2019-5-23,1,0,0
"I do a lot of computer work, and I hate paper jams. To avoid paper jams I use Hammermill Paper, it really does what it says.",5,1,2018-5-9,1,0,0
The product arrived earlier than expected. I am pleased with the product.,5,1,2020-6-2,1,0,0
Just what I was looking for.,5,1,2019-7-24,1,0,0
"I received the box in good shape. All of the paper was intact inside, and the quality was perfect. I’ve had no problems at all with the paper, and it was shipped better than a lot of the reviews I read. I’ll definitely order this again.",5,1,2019-2-4,1,0,0
great paper,5,1,2019-10-5,1,0,0
"Love this paper. I order it all the time for work. Great color, and slides through pretty easy with our HP Office jet printer.",5,1,2018-6-21,1,0,0
Great price for so much paper!  fast shipping and good quality Five stars*****. will buy from again.,5,1,2019-11-5,1,0,0
Box came undone and we were shorted one ream. Not a huge deal but disappointing.,3,1,2018-11-27,1,0,0
Good,5,1,2019-12-22,1,0,0
needed for work to make posters with coupon/tear away flaps at bottom not to take away from my 8.5x11 poster. i have 3 extra inches for my coupons and don't give up valuable poster space for a tear away coupon.,5,1,2016-5-11,1,1,0
Great Product!!!,5,1,2019-10-20,1,0,0
thank you a little slow,4,1,2020-4-22,1,0,0
I always like this paper....like the quality and price....,5,1,2019-5-3,1,0,0
Great,5,1,2020-1-14,1,0,0
All of the papers came intact and in great condition. The paper is nice too.,5,1,2020-2-5,1,0,0
My first review got rejected so I’m trying it again. The box and all the ream wrappers were torn and ripped apart. Very disappointing.,1,1,2019-11-1,1,0,0
NICE,5,1,2019-12-5,1,0,0
The paper was packed well and was in perfect condition on arrival. The paper is a product I always use and is very high quality.,5,1,2020-9-23,1,0,0
This is a good deal and its not bad quality.  My previous purchased was a great deal money wise but the paper was almost see through.,4,1,2019-2-11,1,0,0
"This is only a half case of paper, meaning that the price, presented as comparable to a full case, is a distortion. Same logic as making ice cream containers smaller and raising the price per ounce. Amazon should avoid giving their Choice designation when products are of questionable value.",1,1,2018-9-15,1,0,0
Great paper - expected nothing less from Hammermill. Quality brand and a good price overall.,5,1,2018-10-18,1,0,0
Good deal,5,1,2019-12-17,1,0,0
"I have bought hundreds of reams of this paper and find it to be uniformly consistent and of the highest quality.  Amazon double boxes the paper and I have not had an issue with damage.  The paper is acid free, has a good brightness of 92 and has never jammed.  I really don't know what else you can expect from paper.  It is made in the USA, and comes from sustainable forests.  I will continue to be a repeat customer.",5,1,2018-8-9,1,0,0
"Good paper, 92 bright, this is just regular office copy paper.",5,1,2019-5-25,1,0,0
"Great svc, quality, price!!!",5,1,2019-8-16,1,0,0
Great paper for my home office.,5,1,2019-8-3,1,0,0
"I like this paper, but at least once per ream, my printer pulls 3-6 pages at one time.  I don't think it is a printer issue.",4,1,2019-3-19,1,0,0
Good quality and good value. Fast delivery.,5,1,2020-5-17,1,0,0
"Great to be able to get paper I need with easy delivery, thank you!",5,1,2019-3-16,1,0,0
"It’s paper, decent stuff",5,1,2020-6-26,1,0,0
Its paper.. it works !,5,1,2019-9-16,1,0,0
We always choose this paper for our printing supplies at our office.,5,1,2019-1-30,1,0,0
Good,5,1,2020-7-6,1,0,0
"I ordered one 4,000 sheet box of HammermillPaper. I received two boxes delivered three days apart. These paper boxes are quite heavy. I will keep them. Please be more careful next time.",4,1,2020-5-17,1,0,0
Quick delivery service and good value,5,1,2019-6-12,1,0,0
Was what I wanted.,5,1,2019-9-16,1,0,0
Good paper,5,1,2019-10-19,1,0,0
"Been ordering these for awhile, no issues with printing or delivery.",5,1,2020-7-5,1,0,0
Quality product great value,5,1,2019-12-11,1,0,0
I would buy again,4,1,2019-9-6,1,0,0
Great product at a great price.,5,1,2019-10-18,1,0,0
A++,5,1,2020-6-5,1,0,0
"Good price, good quality and free shipping.  I've found a much better price, as good paper quality, and free shipping since purchasing this product. Because of that I will not purchase again.",5,1,2017-4-30,1,1,0
X,5,1,2019-12-17,1,0,0
It's paper not a master piece. Copy paper.,2,1,2019-5-12,1,0,0
Well made and sturdy fantastic product,5,1,2019-7-12,1,0,0
Not disappointed in the product.  It's a high quality paper.,5,1,2019-5-2,1,0,0
1st shipment was a receipt disaster ... replacement is great and prints well.. will buy again,4,1,2017-9-19,1,1,0
will buy again. better than I had hoped.,5,1,2019-5-6,1,0,0
Perfect,5,1,2020-2-14,1,0,0
quality paper for printing and copying office documents.,5,1,2019-3-4,1,0,0
Boxes were delivered with oil on the top of the boxes and very dirty. The paper appears to be ok. The paper is used in our laboratory for printing purposes.,1,1,2020-9-24,1,0,1
Exactly what I needed,5,1,2020-8-29,1,0,0
Perfect - same price as lugging the box from the store.,5,1,2019-3-5,1,0,0
As expected. Decent paper.,5,1,2020-3-8,1,0,0
"Good product, performed as advertised, would buy again.",5,1,2019-3-1,1,0,0
The most cost efficient I could find.  I am a teacher and perpetually out of paper... This arrived on-time and works well...,5,1,2018-3-20,1,0,0
Great amount of paper for the price. Always prints well.,5,1,2019-7-14,1,0,0
"I clicked reorder hoping to get the same paper I ordered before, but it’s not the same!  The packaging and specs are the same, but MUCH thinner!  I will never order again!",1,1,2019-12-28,1,0,0
Coping,4,1,2019-11-6,1,0,0
Quality paper,5,1,2020-5-23,1,0,0
Best price with delivery at the time.,5,1,2019-12-31,1,0,0
ALL THE PAPER WAS IN EXCELLENT CONDITION,5,1,2020-3-27,1,0,0
These are very absorbing.,5,1,2019-8-16,1,0,0
"Really a wonderful heavy weight, Quality, printer paper...  No Jams!!!",5,1,2019-4-8,1,0,0
good,5,1,2020-3-11,1,0,0
worked as advertised,5,1,2019-7-12,1,0,0
Easy delivery and good paper,5,1,2019-6-17,1,0,0
"Great product, I have reordered many times",5,1,2019-10-26,1,0,0
This copy paper is exactly as advertised.  I am quite pleased with this paper.  We use it daily in our office.,5,1,2018-6-13,1,0,0
Works great,5,1,2020-1-3,1,0,0
Favorite paper for the price. Good quality,5,1,2019-4-2,1,0,0
Perfect for my home office. Exactly as expected.,5,1,2019-3-6,1,0,0
Good value but some of the packages in the box were torn.  Luckily the paper was okay and did not get stuck in my printer.,4,1,2018-3-20,1,0,0
"Great paper, I only wished it was a bit cheaper.",5,1,2019-6-28,1,0,0
Great price and fast service.,5,1,2019-5-26,1,0,0
"It is copy paper, and it works. It is white and 8.5"" x 11"", so not sure how I could complain about this case of copy paper.",5,1,2017-2-19,1,1,0
"Back when I was in the printing business, Hammermill was the only paper we used.  Now that I'm retired, this is the only paper I use in my printer.  GREAT PAPER",5,1,2020-9-7,1,0,0
Great price. Will definitely buy from again,5,1,2019-4-1,1,0,0
