comment,stars,verified,date,country,helpful,has-media
"I've been using screen-protectors since iPhone 5, and until this day, I can not count how many times these protectors have saved my screen from breaking. The glass layer on this protector is very slim and barely noticeable. Installation is quick and straightforward, following the guide and using the right tools. If you still see a few smaller air-bubbles, don't worry, something es it can take up to 24 hours until all bubbles disappear.",5,1,2020-7-15,1,0,0
muy bueno. recomendado. no trae aplicador entonces si no tienes experiencia en poner vidrios te puede asustar.  pero es muy facilel vidrio es muy bueno. buena calidad. olefobico  y suave al tacto. parecen los belkin solo que no tan costosos,5,1,2019-2-20,1,1,1
Easy to apply. Keeps screen much cleaner than other screen protectors (oil doesn’t build up). No far no scratches or lifting of screen. Very pleased!,5,1,2020-8-7,1,0,0
"When the delivery arrived I opened the box, and 2 out of the 3 protectors were already damaged. I don’t have time to return and ship back but just watch out for your product.",3,1,2019-10-25,1,1,0
Much cheaper than the ones at your local cell phone store but just as good. Do yourself a favor and save money buying from here.,5,1,2020-5-8,1,0,0
I dropped something heavy on my phone and saw a crack on my screen. I called to have someone come fix my screen and turns out my phone screen wasn’t even broken!!! It was this screen protector! I couldn’t even believe it! Peeled the protector off and my phone screen was untouched. I will never use another screen protector. I normally don’t write reviews but this product works sooo well I had to.,5,1,2020-7-11,1,0,0
It lasted just 2 days before I got a crack in the corner that eventually ran up the side the of the screen. Will put on the second one and see how long that last me.,2,1,2019-11-3,1,0,0
This screen protector has to be the best one I’ve installed on my phone. It’s very easy to apply and it has no air bubbles. I will be purchasing again!,5,1,2020-4-26,1,0,0
"I installed the protector about a week or two ago, dropped the phone from a not so high distance and it already shattered. I’ve never had a screen protector crack so easily.",2,1,2020-1-17,1,0,0
These are my go to screen protectors not only are they affordable but they last so long! I drop my phone CONSTANTLY and it always takes one big fall for it to crack and it’ll be even the smallest cracks too. It’s not much of an anti glare but it does the job and it doesn’t cause a glare either. Great price for a pack of 3!,5,1,2019-12-30,1,0,0
"I bought these twice!  These are so good!  Super affordable and easy to install.  I only needed more because I was a touch too rough with my phone. 🙂 thankfully my phone didn’t get damaged, only the screen protector.",5,1,2020-7-5,1,0,0
"It covers the whole touch screen, But not further, it protects the screen from scratches (assuming that I have scratched it with something that could have made a scratch). Only downside is that the protector is quite thick at the edge rather than rounded or tapered so it is a bit noticeable.",4,1,2020-1-22,1,0,0
Cracked two days later,2,1,2020-3-8,1,1,0
Too early to know scratch Resistance yet much better value than the Belkin glass installed with Apple device In store which scratches/crakes easily (tried three). So this has not scratched whereas the Belkin one had even with my Otter case.,5,1,2020-7-31,1,0,0
"Works good. First one cracked pretty quickly though and I took it off. Haven’t put the other ones on yet, but it was easy to install.",5,1,2020-1-8,1,0,0
"They worked well on my brother's XS Max. Pretty easy to install, similar to all glass screen protectors.",5,1,2020-1-19,1,0,0
"I put this on right after taking my phone out of the box. Fits my pro max great, basically everything you'd want out of a screen protector. Great touchscreen contact, protective, sleek.",5,1,2019-10-23,1,0,0
"Works perfectly! I was so grateful for this little protector. I dropped my phone the first day and sure enough this huge crack began to spread across my screen. Luckily I pulled it right off, kissed my screen and applied another one! Totally worth it!!",5,1,2019-3-18,1,0,0
"just got new iphone and of course like any other apple products this requires great care as well so i purchased this screen protector, its been great having it because its easily cleanable and it was really easy to install and not only but its taken care of my iphone more than anything.",5,1,2019-5-1,1,0,0
Not sure why this product got so many stars? My tempered glass broke on the first day without dropping the phone at all. The phone was in my pocket and when I took it out it was cracked. I thought maybe I got a defective one so I put another one on the next day and it cracked again. Disappointing!!! The quality is not there! Very weak!,2,1,2020-9-21,1,0,0
Very easy to put on with great instructions. I had a bubble I couldn’t get off and I simply took it off and did it again.,5,1,2020-6-10,1,0,0
"This is the best brand of Screen Protectors. I use them for every iPhone that I ever had, they have never failed me. My screen has yet to break when ever I dropped my phone while using this product. I recommend this product to any and everybody that has a smart phone.",5,1,2020-6-11,1,0,1
"Very reasonable price, includes three screen protectors. I’ve paid far more for one at a phone repair place. Easy to apply. Follow the instructions and you won’t have any bubbles.",5,1,2019-11-17,1,0,0
"Great sensitivity to touch. It covers the screen space that is lit. If that makes sense. A little off on my cut out. But it’s not noticeable, for me anyway. So far so good and have been using about 4 weeks.",5,1,2019-4-1,1,0,0
This a great product.  Inexpensive yet it is delicate to the touch and very protective.  I highly recommend it.,5,1,2020-1-17,1,0,0
"Love this screen protector! Easy to place on, nothing else to it! The price for this is also well worth it for 3 screen protectors! Will definitely be buying again for my next set of iPhones.",5,1,2019-4-14,1,0,0
Why 3 - business phones fall and need the screen replaced. These ones fit perfect and work great.,5,1,2020-5-4,1,0,0
This is my 2nd package of the these since October. So I’ve gone through 6 screen protectors. They crack very easily. I won’t be wasting my money on this brand anymore. I don’t advise buying them. Unless you want it to crack within 2 weeks and have the cracks getting bigger until it annoys you enough to switch it out.,1,1,2019-4-16,1,0,0
AS I HAVE SAID I AM A TEMPERED GLASS SCREEN PROTECTOR PERSON I SWEAR BY THIS PRODUCT THAT IF YOU DROP YOUR PHONE FACE DOWN YOU WILL NOT CRACK YOUR PHONE SCREEN ALTHOUGH THE SCREEN PROTECTOR MAY OR MAY NOT,5,1,2020-5-14,1,0,0
Scratches very easily compared to others I have bought in the past. Would shop for another brand.,1,1,2020-1-12,1,0,0
"I’ve bought this same items a few times now. I personally love them. Both myself & my mom use them & they work amazing. Never have had an issue with my screen itself cracking or breaking, it’s always been the protector which is awesome. I have the IPhone XS MAX & it fits perfectly on our phones. I will continue to keep buying this item.",5,1,2020-5-19,1,0,0
Ok for the money. I found few other brands that gives another tool to install the product quite easy. Quality wise it’s very good product,3,1,2019-1-22,1,0,0
"Although I recently started using the screen protector, so far it is a fine product.  It was easy to put on the iphone screen.",5,1,2019-1-2,1,0,0
"This was really easy to instal. As soon as I drop it down to the phone, it automatically pressing down and no air bubbles.",5,1,2020-5-2,1,0,0
Arrives quickly. Went on easily. But I didn’t even drop it. And the screen protector is cracked after only 3 days!!!,3,1,2020-7-14,1,0,0
"I’ve purchased these probably 3 or 4 times now. They have saved mine and my husbands phone numerous times. Love this product, will continue to buy them!",5,1,2020-7-26,1,0,0
"Just put this on my extra iPhone 11, barely carried the phone 5 times and the screen protector is already cracked. Cheap and terrible quality.",1,1,2020-2-24,1,0,0
This product arrived timely and it was easy to apply on my phone.  I love the smooth feel to help with the operation of my phone.,5,1,2020-9-19,1,0,0
"I placed (dropped) it into position and pressed in the center with one finger and it self sealed the rest. I traced the edges to make sure they were all the way down. I did two phones back to back, the first one I missed a spot of dust I assume and there was a tiny bubble, it has been a week and it has already vanished.",5,1,2020-1-20,1,0,0
Great value screen protectors! These have saved our phone screens several times. We’ve ordered multiple sets now.,5,1,2020-5-12,1,0,0
The screen protector is not good quality. The phone fell on the floor half a foot and the protector broke. It is better to buy one more expensive but be of higher quality.,1,1,2018-11-6,1,1,0
I just purchased this product. I was dreading putting it on my phone. In the past this has always been a daunting project BUT....this couldn’t have been easier to apply. With the tabs you can place it with control and once it touches the phone it immediately starts to smooth itself out. You hardly have to touch it yourself. No bubbles and no hassle. Love it!,5,1,2020-4-2,1,0,0
These crack very easily went through all of them in a month just from shifting in my purse. Would not recommend,1,1,2020-6-15,1,0,1
Their shape is NOT matched to the iPhone 11 pro max. The edges don't march the visible screen,1,1,2019-11-5,1,0,0
"Good thing it came in a three pack, cracked the first screen pretty and the second screen is cracked but works good enough still. Good buy, saved my screen",4,1,2020-8-28,1,0,0
In less than two weeks I went through all 3 of these. They would break for no reason. No drops or anything I would pull out of my pocket broken. Would not recommend,1,1,2019-10-11,1,0,0
Cover does not completely cover the glass that needs to be protected. I broke my phone glass where it did not cover with it literally a few centimeters :/,2,1,2019-11-18,1,1,0
"You can barley tell it’s on, which is perfect! I’ve already dropped my phone unfortunately, but thankfully I already know it works! Was very impressed with the installation process and they provide you with all the right tools.",5,1,2019-12-9,1,0,0
Excellent case 3 one I have ordered like to change the colors but strong especially when you drop.,5,1,2020-8-2,1,0,0
"fit perfect, came with a wet wipe, dry wipe, and a dust sticker to make sure it sticks perfectly",5,1,2020-1-8,1,0,0
This screen protector was very easy to install and worth the money. I was skeptical in buy this product due to quality and durability but I had this protector on my phone now for a couple of weeks and it’s lasting still. I guess it’s worth the month.,5,1,2018-10-31,1,0,0
"The screen protector cracked after gently placing my phone on a glass table (not dropped or tossed, casually placed). Maybe it’s a defect, but I’d hate to see what would happen if I dropped the phone with this on.",2,1,2019-10-31,1,0,0
Really good. Dropped my phone twice and still walking around with the first protector. No cracks.,5,1,2019-12-16,1,0,0
"These are not the best! They keep off finger prints, but just setting your phone down a bit hard cracks the protector.",2,1,2020-5-8,1,0,0
"Great product, great fit, very easy to install. Will definitely buy another one soon.. Thank you",5,1,2020-1-15,1,0,0
This is my second time buying these screen protectors (new phone) They did not disappoint before and I can say the same here. I usually share a pack of 3 with my mom and sister because they hold up so well I usually only need 1 for the life of my phone. Fits phone XS max perfectly!,5,1,2020-7-12,1,0,0
"Bought these and put it on the phone, phone fell a few days later not even that hard. Screen cracked!!!! Assumed it was the the screen protector and for a minute I was so happy I purchased them but I then removed the perfect screen protected to find my actual screen shattered! What a scam! XS Max is $280 to replace the screen!",1,1,2019-4-22,1,0,0
"Has always been a family favorite and it continues to be. You would think I live under a rock, it’s the 1st time I’ve purchased this brand on Amazon. Arrived as expected!",5,1,2019-11-28,1,0,0
The product came as advertised. The cost was a great value. This is the second set of glass screen protectors I have purchased. The first from a competitor were thinner and cracked easily. These new screen protectors “ feel “ thicker and are performing great. No problem recommending them at all.,5,1,2020-3-14,1,0,0
Love this protective cover. This glass is sleek and durable. Very easy to install and phone works perfectly with it on.,5,1,2020-3-7,1,0,0
"This product defense to the max if you drop it from 20 feet it wouldn’t break wow this is practically a tank I love this product so much I would rate it 1,000,000,000% out of 1000 billion",5,1,2019-11-27,1,0,0
"I usually ask my daughters to do anything technology related for me, not this screen protector though, it’s so easy!",5,1,2020-2-15,1,0,0
After 4 months still on my first screen protector out of the box and I’ve dropped my phone plenty of times and still not a scratch or crack,5,1,2019-4-24,1,0,0
Every time we need new screen protectors we always order them from you! Easy to place on phone with great protection!,5,1,2019-7-13,1,0,0
"I’ve installed other before, and they looked better than this one. Did not seem to be super good.",2,1,2019-11-24,1,0,0
These screen protectors does exactly what it claims to do. There’s no glare & easy to install. I have no problem navigating through my phone & texting. Comes with wet & dry wipes! I would buying these instead of going to an AT&T store or any carrier store for a screen protector that would cost $20+. These screen protectors cost way less & just as good.,5,1,2019-9-21,1,0,0
When I took the plastic off the screen protector I didn’t even touch the sticky side and there was already a fingerprint and smudge.,4,1,2020-6-20,1,0,0
The product is very easy to install. The issue I have is that I had one start to peel off the phone and the second screen protector cracked for no reason. I have never dropped my phone or anything. Maybe this is all due to being a new production for the new phone and still needs the wrinkles ironed out.,1,1,2019-12-8,1,0,0
"I put this screen protector on my phone hoping that it would...protect my screen. It didn’t. I dropped my phone in my house. I dropped it I a place that wasn’t crazy just in my house and I had one of these “screen protectors” on my phone and I dropped my phone and my screen cracked. Not the screen that I bought here, but my actual iPhone screen. It’s very frustrating. DON’T BUY THIS PRODUCT. YOU CAN DO BETTER!",1,1,2020-6-13,1,0,0
It’s very easy to install but the glass is small for iPhone XS Max. Still using it. But I don’t thing how long it will last. Not convenient when the glass is small for the screen,3,1,2019-3-1,1,0,0
"Adheres perfectly for the first 6 hours- air bubbles appeared after making it almost impossible to type on phone. Horrible product.. Started out perfectly adhered after meticulously cleaning screen in preparation. 6 hours later useless, waste of money.",1,1,2020-7-29,1,0,0
Pack of 3 was definitely needed. I’m 1 month after purchasing and have already gone through all 3! The slightest bump and your protector is destroyed! I never have had this issue before. My last phone screen protector lasted almost a year.,2,1,2020-7-27,1,0,0
This was so easy to apply to my phone!  It is perfect.  It works great and you can’t tell I have it on my phone.  Arrived early too.,5,1,2019-1-29,1,0,0
It was very easy to install and my screen is crystal clear. I will NOT be spending $25-$30 on anymore Zagg or any other brand screen protectors from now on. I will be ordering more of these before I can’t get them,5,1,2020-6-1,1,0,1
I cant believe I had paid over $40.00 at Verizon for fewer protectors.  This is a huge savings and seem to be holding up much better than the Verizon product.,5,1,2020-2-4,1,0,0
They do In fact protect the screen well. However these are weak and break on a smallest of drops. If you even put your phone face down to hard it crack. Comes in a 3 pack but you’ll go through them so quick.,3,1,2020-9-20,1,0,0
"This screen protector was very easy to apply, came with all supplies needed, and fits like a glove! No glare, no rainbow, no issues with touchscreen. I would buy this again however, it comes with 3 so I may not need to!",5,1,2019-10-10,1,0,0
"Easy to put on, no glare and doesn’t even feel like I have the protective screen on. Only down side is that I noticed the protective screen cracked easily. I also got this for my wife’s iPhone 11 and she notices the same thing with the protective screen cracking so easily. Overall, very happy with it.",4,1,2019-11-5,1,0,0
Purchased for my bf and he really liked this product. He said it was easy to apply it and it’s lasting,5,1,2020-1-20,1,0,0
They fit nice and do the job. I bought this pack after spending $40 on a single glass protector that cracked within a week. These ones also crack pretty easily (if you drop your phone a lot like me) but they’re cheaper and you get three. It’s a good deal and I’d rather switch out cracked screen protectors than a cracked screen itself.,3,1,2019-12-21,1,0,0
Very happy with this purchase. Doesn't cover the front facing camera or ear piece like my old screen protector.,5,1,2019-7-2,1,0,0
This was exactly what it says it is.  It is so refreshing to order something online and get exactly what you think you are supposed to be getting.  Super easy to install and I'm still able to touch my screen.  Smudge proof too!  WIN WIN,5,1,2020-1-15,1,0,0
"Just like that... no anti-glare, no smudge-proof and cracked from top to bottom the second day and I have been taking care of the phone as much as I have of my baby...",2,1,2019-4-11,1,0,0
Perfect fit for my Series 4 Apple Watch. Does not crack or scratch. No glare and great touch screen.,5,1,2019-10-26,1,0,0
Did not realize this set doesn’t include a plastic guide frame for aligning the protector. I had to use all 3 to get it straight when I’ve gotten right every time with protectors that come with a frame. Disappointed I had to use the whole pack already. Will not order again unless it includes the frame.,2,1,2020-2-26,1,0,0
"This protector was easy to install but within a week of installation, bubbles developed all the way down both sides of the screen. I cannot work them back out. I had it perfectly installed with absolutely no bubbles and was very pleased until these developed.",3,1,2020-7-21,1,0,0
It does the job and when the phone fell it cracked but the phone screen wasn’t.  I guess that’s what is supposed to happen.,4,1,2019-7-8,1,0,0
"As cheap and easy as these things are, I can think of no reason for anyone to have a phone that doesn't have one on it.",5,1,2020-1-17,1,0,0
This is probably the easiest to install screen that I have ever used.  Very happy so far.,5,1,2019-11-18,1,0,0
"Comes with stickers for dust, wet wipe to clean, dry to clean and it works very effectively",5,1,2020-3-9,1,0,0
Using it on my phone right now. Broke pretty easily but I’m very clumsy. Good thing it comes with 3!,4,1,2020-6-7,1,0,1
"This was a waste of purchase, I just brought this screen protector for me and my friend and BOTH of our screen protectors cracked. We did not drop our phones. Overall this occurred TWO DAYS after it was installed.",1,1,2020-2-26,1,1,0
Highly recommend and very affordable compared to other (expensive) screen protectors.,5,1,2019-10-23,1,0,0
"Seems to be VERY easy to crack, I’ve gone through two of them in less than a week.  The first one cracked when I set my car keys on my phone.  The second one I don’t even know how it cracked, the phone hasn’t been dropped once since I started using these. Seem to be a lower quality glass.",1,1,2020-8-8,1,0,0
"Super easy to install , protects my phone very well. It’s been dropped so many times and it hasn’t even gotten a scratch",5,1,2020-7-25,1,0,0
It is easy to install. May need a little self-skill to install without dust or bubbles under. (lol) Have been using it for quite some time and it doesn’t scratch easily. Helps protect the screen really well. No problems with touch screen function or visuals.,5,1,2019-9-27,1,0,0
"Best ones I have purchased , easy to put on phone and no bubbles the first try .",5,1,2019-12-3,1,0,0
"Good screen protector, really protects your phone and given extra screen protectors in case the first one cracks, easily removable. From my honest view point, I had this screen protector for a year at least and doesn’t leave any sticky residue nor comes off. Yes I wrote this even though I had this long time ago, I wanted to experiment to see whether this product was legit and it was.",5,1,2020-5-31,1,0,0
It does not fit the iPhone XS - too long by almost a cm,1,1,2020-2-26,1,1,0
Product was very easy to install and I didn't need my husband this time. No bubbles at all.. Love this brand. I used this brand for my other phones and my kids phones too. works great.,5,1,2020-1-21,1,0,0
It’s very fragile. It broke after 3 days .. and I don’t even know how. Didn’t drop the phone or anything  🤷‍♀️,2,1,2020-1-17,1,0,0
"Protectors were easy to install and I appreciated all of the supplies that was included to install them onto the phone. Came with multiple screen protectors, but they crack very easily. Every time I dropped my phone, the screen protectors would automatically chip on the sides and then the cracks would just easily spread across the entire screen.",3,1,2020-2-18,1,0,0
Works exactly as advertised. Minimized glare on my screen and has saved my screen from a few scratches already,5,1,2020-3-12,1,0,0
Great product. Have dropped my phone twice on hard surfaces since install and not a scratch!,5,1,2020-2-18,1,0,0
Fits good and looks good on phone! Works great on protecting screen! You get three screens!,5,1,2020-8-7,1,0,0
"Definitely benefits you more then anything, for about 2 bucks each one is a no brainer. When your phone cost 1100. ... so add 10$ insurance for 6 glass covers definitely worth it .",4,1,2020-3-21,1,0,0
Goes on easy but it got a chip on the side and I have no knowledge of the event that caused it so it must have not been that hard of an impact.,2,1,2019-10-27,1,0,1
Easy to install and it’s like I don’t even have a screen protector on as far as looks go. The only thing I think could improve is when wiping it clean - it tends to look smudged unless cleaning it with something moist.,5,1,2019-12-16,1,0,0
First glass installed and it cracked. Second glass on and it cracked and all what happened was my phone fell on my carpet. This product is trash. Need so find something better.,1,1,2020-1-16,1,0,0
"Works like it suppose to. Like it’s a complete kit..wet/dry wipes. Screen guider, and screen itself feels good.",5,1,2020-5-21,1,0,0
These screens keep chipping and cracking very easily. I just put a new one on yesterday and it already cracked.,3,1,2019-12-13,1,0,0
"It okay, the first screen protector had a weir spot on the application side, not dirt, not air had to use the second one that was okay, should be a good protection for the screen",3,1,2019-11-18,1,0,0
It’s already scratched after having it for 5 daysGood to have but easily scratch,3,1,2020-9-16,1,1,0
"Currently protecting an iPhone XS Max. I trust the form, fit, and function of this screen protector. Looks professional.",4,1,2019-4-19,1,0,0
It comes with three screen protectors. They are very very easy to put on very easy absolutely love the product,5,1,2020-1-17,1,0,0
I usually don’t write reviews but when a family member asked me what screen protector I had I remembered buying from Ailun! It’s done it’s justice in saving my screen so many times that I bought one for the new iPhone 11 Pro Max and as always I’m satisfied with the service and product! Would recommend to anyone looking for a good screen protector!,5,1,2019-10-16,1,0,0
Bought these-got 3 and just as good as the ones you buy in cell store for $40 a piece.  Had mine on for couple months-no scratches. No glares and it’s not popping up anywhere off the screen,5,1,2020-6-29,1,0,0
"When impacted , like a windshield  cracked in all directions but completely protected my iPhone screen 100% (2nd time purchasing product)",5,1,2020-8-20,1,0,0
Great screen protectors I also love that there’s more than one in the package so even if one breaks you can always switch it out this product is affordable durable and easy to apply.,5,1,2019-11-9,1,0,0
I will NEVER buy or recommend this product!  I dropped my phone ONCE on my bathroom floor and my iPhone screen shattered! My question is does the manufacturer have a warranty that covers a screen being replaced?,1,1,2020-3-27,1,1,0
Easy to put on- more than one- amazing deal - flare still occurs. Crack easily but still good deal. Saves the phone,5,1,2020-6-8,1,0,0
Works great- easy to install. Absolutely perfect fit for the iPhone 11 Pro Max!,5,1,2020-1-30,1,0,0
"Pretty good screen protector, had to remove the screen protector my case came with because it wasn't making contact with the touch screen and this works perfect with my iPhone 11pro max",5,1,2020-1-27,1,0,0
My lord how strong is this! I shot the phone by accident and it saved my life! Lol jk but this is really good to protect your phone and you should it’s an investment buy the dang screen protector!,5,1,2019-5-22,1,0,0
