comment,stars,verified,date,country,helpful,has-media
"Wow...just wow.  I figured this would be a cheap film, but it was a nice crystal clear piece of hard plastic that once applied was invisible and will clearly add scratch and break protection. Some have said it was hard to apply.  Before pealing off the film do a test fit and a hinged application (start at top near earphone). The iPhone X has a rounded glass screen and this protector ALMOST goes to the rounded edges.  Once you have figured out just where to start, peel off the film and apply (again, think hinge...start at the top, get that edge where it needs to be and drop rest.  Now, here is where the fun begins...if doing this under a good light, which is recommended, you will see the ""adhesive suck"" effect as I call it, in which the protector actually seats itself...no pressing...don't press.  It will seat itself, no bubbles.  Just let it do it, let gravity do its part.  I am using it with a Spigen case and it all looks great, works great.",5,1,2019-1-4,1,2,0
"Much better value than the $30 phone retailers ask for for screen protectors.  Easy to apply, comes with both wet and dry cleaning wipes to clean your screen with and stickers to help align the protector onto your screen.  Great value.  Will be purchasing again once I go through the 3 it comes with.",5,1,2018-11-15,1,1,0
This is the worst screen protector I’ve ever encountered . I put screen protectors on on a regular basis at my job . These are IMPOSSIBLEMind you this is also the second time I tried all three cause I got the original ones exchanged for the same reason. I clean it perfectly follow instructions but the last second you try to put it on and it sucks every particle in the air . That’s with never putting the sticky side face up.,1,1,2019-9-28,1,1,0
"Great product!  I got this screen protector for my wife’s phone and mine; we both love it! It’s a little tricky to place because you only get one shot. I put mine on first and it’s just a hair crooked, but I was able to place the screen protector on my wife’s phone with no problems. Maybe that’s why you get 3 in a package. If you screw up you can take it off and try again with a new one. The best part - the nearly identical product I almost bought at Target is $50. So glad I checked Amazon first!",5,1,2018-11-27,1,1,0
"First of all, this product does not come with a frame for easy installation.Second of all, when you apply this screen protector, you have small bubbles. When you try to get rid of them by rubbing to the ends of the screen, they divide again to form pesky miniature bubbles. These do not go away and remain bothering the aesthetic of your iPhone.",1,1,2019-9-29,1,7,0
"This is the second time i've ordered this item because i really like the quality and ease of installation. But the second one i received is not new.All three of the tamper tape seals have been removed and put back on and the box has been torn. Contents may be fine, may not. But i want confidence in receiving new product when i purchase from Amazon and pay a new price. I don't want to gamble, deal with disappointment and returns as if I'm buying stuff from a used reseller. This is happening too often lately on Amazon. Will return.",1,1,2020-4-10,1,6,0
"Product arrived on time and packaged to protect the product.  I received an email from the Seller with application instructions prior to the arrival of the screen protector.  It was helpful, but not really necessary due to the ease of the application.  I felt confident that I could do it with no assistance.  It went on easily with no bubbles.  It still shows fingerprints but that isn't a huge deal for me.  I would no hesitate to recommend this product to others.",5,1,2018-10-14,1,5,0
So first attempt I placed the placement stickers on the outside while I’m lifting it to put it over the screen they are so flimsy the screen falls and gets lint all over it. The second attempt my husband is installing the screen protector and the protector just snaps and breaks. Thankfully I bought the 3 pack so last attempt we get it on and I leave my phone sitting come back and the screen protector is cracked. Nobody touched the phone.  So I wasted my phone...,1,1,2019-3-2,1,6,0
Love this product! It was easy to install and it works perfectly with my new iPhone.,5,1,2018-10-18,1,7,0
I really like the screen protector but one of the three was cracked on arrival and not useable and the other one kept coming up at the edges after I put it on. I will say that it could be installers fault on the second one but the third one went on without failure. I tried to contact seller for there warranty claim and it to get at least the first of three screens replaced but they have not contacted me back so this review is two stars. Out of the three one eventually was great and is a nice screen protector. But one is not what I paid for.,2,1,2020-5-30,1,0,0
"I made the mistake of paying $40 for a zagg screen protector when I bought my new phone because I was told it’s the best and FREE replacements if anything goes wrong. Huge lie!! I’ve been through 3 screens in less than 7 months and it’s $10 to replace each time, plus they say it’s scratch and ding resistant which is another lie. This Ailun product comes with 3 protectors, because let’s be honest, nothing is 100% scratch and crack proof, and it goes on soooooo easily and looks like melting butter as it adheres to your phone. Bubble proof and perfect!!! I will always buy all future phone screens from this company and never again from anywhere else! Best price for this product!!",5,1,2019-8-28,1,2,0
"I love these screen protectors. They have been my go-to brand and I like to have back up readily available whenever I drop my phone and need a replacement screen protector.  I’m happy to report that out of all the times this brand screen protector has been used, it has always served its purpose and never failed in protecting my iPhones. I have tried the other popular brand “zGagg” and to get the replacement you have to pay $5.99 for shipping... uh no thanks. I’ll always keep these handy and will recommend to others.",5,1,2020-2-4,1,0,0
"I ordered the item. One of the screens was broken in the case. It's glass got everywhere and was really fine and airborne and breathable. they are supposed to have laminate layers to protect users. If this screen breaks. You will get micro slivers of glass in your mouth and eyes.Also, this product IS NOT anti-glare as labeled.  It is ALSO NOT scratch Resistant.  Be careful about buying bad products that are not manufactured by the company they claim to be from.",1,1,2020-5-31,1,0,0
Super thin and didn’t come with the frame to assist with install. With so many other competitor products available seems like a miss to not include such a helpful tool for this product. The screen protector itself is VERY thin so if you’re used to using these don’t be surprised at the thickness. Also it came with 3 screen protectors but only two wipes? Which we had to use on the first install due to it not being moist enough to properly clean the screen.,1,1,2020-8-3,1,0,0
"I have an iPhone 11 Pro Max. I carefully followed their instructions and it was easy to install. The scariest part is making sure you lay it down centered and in the right place, but mine came out perfect. It is hardly noticeable that it is there!  I was worried that it would effect the touch on the screen, but there is absolutely no difference! I'm glad to have it there to protect the glass on the phone!  I don't know about the Anti-Glare rating above, once installed, it literally looks the same as without it. Definitely a good product and well worth the price!",5,1,2019-10-25,1,0,0
"Awesome screen protector! Touchscreen works flawlessly through the protector, the glass feels exactly like the original screen and it works amazingly to protect my phone.I dropped my previous phone face down on a grave drive way and my previous screen protector did nothing to protect it, so when I did the same thing with my new phone and this screen protector I was expecting the worst. To my surprise the screen protector did an excellent job of protecting my phone. This screen protector is layered with plastic similar to windshield glass which kept rocks from penetrating and cracking my screen. On top of it all  these screen protectors come 3 to a box so I had extras to replace the one I had broke .",5,1,2019-12-6,1,0,0
"Was paying $30+ for a 9H screen protector at my cellular carrier store with the “you buy this and get five free replacements” gimmick and then when I went in for the replacement, it was okay for the first replacement. After the beginning, it’s a run-around. “You need the actual box to do a replacement.” Well, Karen, you took the box on my first one and threw it away and didn’t tell me I needed it even when I asked. So, yeah, much cheaper, and you get three!! Same quality as my alpha glass was without the run-around from ole Karen at the store. Highly recommend!!",5,1,2020-7-28,1,1,0
"I have mixed feelings about these screen protectors. It seems to me like they break fairly easily. I’ve had screen protectors in the past that I don’t have to change for months whereas these I have gone through the pack already.  But at the end of the day, they do serve their purpose. They do protect the phone because the screen protectors have cracked but my actual screen is intact. They go an easily & the touch receptiveness is as if nothing was on.",4,1,2019-12-30,1,0,0
"Guys, this a great deal. It’s pretty competitively priced. The only thing I hate about it (along with many other screen protectors) is the stupid notch on the top. They could just cut out a notch for the speaker part but instead cut the whole top out. This makes it feel rather annoying on your Fingers as you end up swiping from the top to the bottom several times a day and that hump between the screen and the protector is pretty obvious. Other than that grip, it was rather easy to install. Offers decent scratch resistance and protection. As for the toughness of the glass, only time will tell. Hoping for the best!",4,1,2019-10-28,1,0,0
"I bought because it was fast shipping and it came in a pack of 3 but I purchased 11/25 and it’s now 12/26 and I’ve gone through all 3 already. I’m a little frustrated with myself because I thought as long as I take care of my phone it would last but with every clink it broke! I haven’t even dropped my phone yet. The first broke the next day, I noticed a sliver on the shield. I advise to just purchase one of good quality over more quantity. It really pays off.",3,1,2018-12-26,1,5,0
"I’ve gotten lots of different screen protectors through the years.  Most all of them, I only needed one and it lasted for years.  With this brand, I have already gone through two in a few months.  Not dropping my phone or being rough with it.  They just seem to crack VERY easily.  I’ll use them up but will not be buying this brand again.",1,1,2020-8-7,1,1,0
I’ve tried a lot of different phone protectors for each new phone I get & these are by far the very best!They give you everything you need to apply correctly to your screen.,5,1,2020-4-28,1,1,0
"My phone basically lives on the floor so I go through these like crazy. I’m not affixed to one particular brand, I just look for packs of 3 to make my life easier. These were okay. I installed the first one today and from my experience with previous screen protectors I wasn’t all that impressed. The packet that was supposed to be “wet” was almost as dry as the dry one. And the dry one didn’t seem to clean the screen that much I had to use my glasses cleaner for it. When I went to install it, the little grip stickers that go on the sides to avoid smudging the sticky part were A PAINNN they kept un sticking and I ended up using my own tape. I’m not exactly a professional but I have purchase a bunch of these and this brand by far has been the hardest to work with. Probably won’t buy again.Overall,",3,1,2019-10-28,1,1,0
"At first glance this seems like a freak screen protector. It goes on easy, it’s nice and clear and it fits well with a case. It seems like a good deal too, you get 3 in a pack.Well, now I know why. I have had my phone for about a month... I’ve already gone through two of these.  I’m going back to the Zagg screen protectors. They cost more but you get a lifetime warranty and they are built better.  I’ve only ever had to get a replacement once or twice in the whole lives of my past phones.",2,1,2019-10-28,1,1,0
"This screen protector deserves a 5 star in my opinion! I currently have an Xs Max and this screen protector is way better than zagg’s overpriced screen protectors that break easily!!! When I had a 7 plus, I bought this screen protector for the 7 plus and lasted for over 2 years without a scratch or a crack after being dropped multiple times. At the beginning of this year (April) I upgraded from 7 plus to my now Xs Max and bought a Zagg screen protector (Glass +) at Verizon for $40. The zagg one was applied by the customer service rep and it had problems with the bubbles that won’t go away even after trying to rub them out. I went back and they gave me a replacement zagg protector which also had bubbles issues then 6 months later it cracked when my phone dropped from the couch to the floor. I emailed zagg and got another replacement (glass elite) which cracked on the same day after dropping it again. My point here is, I’ve had cheap ones that I dropped multiple times without cracking and then decided to buy zagg ones and they cracked right away! I’m done with Zagg! These cheap ones are way better! And that is why I made the decision to but this $6.99 screen protector because not only are they affordable, but they do work better. I don’t understand why zagg sells theirs for $40 and they break easily while these cheap ones last forever!",5,1,2019-10-22,1,1,0
Like how easy it wast to install but they are garbage! The screen cover glass cracks if you look at it too hard!  Already used all 3 in about 2 weeks and I’m super careful and have never dropped my new phone. Not sure what type of glass they are made of but it must be super cheap. I guess you get what you pay for!!,1,1,2019-3-5,1,5,0
"If you need something to get you through for a week or two until your quality screen protector arrives, this will do the trick, otherwise small drops (less then a finger's length"" will result in ""cracks"" onthe protector which will become annoying to look at and make you want to install another one from the pack. I wouldn't recommend for long lasting durability or strength. This is coming from someone who's phone & screen is always in pristine condition when trading in after 2+years of owning the original device.",3,1,2020-2-26,1,2,0
"I ordered the 3 pack and have already put 2 of them to good use. The day after I put it on, I was walking with my hands full of groceries and my phone fell face down on the pavement from about a 4 ft drop. I smashed the screen protector, but the phone was completely fine! Not even a scratch on it! Then, this pst weekend I had set my phone on the hood of my truck, it slid and hit the concrete right on the edge. I have 3 little cracks in the current screen protector, but again, my phone is perfectly fine! I would highly recommend this product! I will be purchasing more here soon. (Since apparently I can’t have them last for more then a few days🤦🏻‍♀️).",5,1,2020-8-3,1,1,0
i love this product! it was so easy to install! it came out absolutely perfect!,5,1,2019-9-22,1,1,1
"You drop your phone in your carpet and your screen protector are gone, thats what happened with me, me and my wife both  replaced this one with some other cheaper but durable one. not worth to the price we paid, i dont know this is how it supposed to be or we were careless , i dont like it at all, but you may give a try. Should have included installation guiding frame to ease the installation. You have to align manually along the edge during installation, thats difficult way of installation",2,1,2019-2-4,1,1,0
I bought these for my iPhone 11 - total junk.  All three were cracked within a month.  I owned a iPhone 7s before Which was is the same size as this 11  and I was using the same style case I am now si this isn’t an issue of user error.  I get it - these prevent your screen from cracking but these should not have cracked so easily and soon.  I’m going to try and find the same brand I used for my last phone ( never cracked Once and still on my phone),3,1,2020-5-21,1,0,0
"This was definitely the easiest screen protector I've ever installed on a mobile device. Typical normal instructions, wipe w/wet towelette, dry with dry towelette, use dust sticker to catch any particles and, holding on to edge of protector, place it on the screen. This is where the difference came into play. As soon as I placed the protector down on to the screen, you could see it automatically start to adhere to the screen and push out any bubbles. I did not have to use the credit card type scraper most of the others require you to use to get a good adhesion. It was very cool to watch how the protector worked out the bubbles itself and now I have a screen with absolutely no dust, debris, hair, finger prints or bubbles under the protector. First time I've ever had a perfectly clear protector/screen. Very clear protector that fits within my Spigen Ultra Hybrid clear cover.  I can't speak to its durability yet since I only just applied it.I purchased this cover for myself and was not compensated in any way by Ailun nor even asked to complete a review. I was just so impressed at how well this went on to my new iPhone 11 Max Pro that I wanted to leave a comment.",5,1,2019-9-25,1,0,0
"I’m pretty happy with this screen protector. I had this same one for my iPhone 7 Plus and it lasted me almost an entire year before it started getting old and needed replacing. Ive dropped my iPhone 7 Plus plenty of times and the screen protector saved the day. So we will see if it lives up again with this IPhone XS Max protector. The reason I made it 4/5 starts is because I wish it covered a little more of the screen. It strictly protects up to the borders of the lit screen, leaving about a millimeter of space between the protector and a phone case. I’m not sure if that’s how all screen protectors for this phone are or not, but I personally would feel better if it covered the entire screen, not just the lit part. Overall, I’m happy with it and I hope it protects as well as it did with my IPhone 7 Plus.",4,1,2019-3-11,1,1,0
This product saved my butt today. I dropped my phone today which I almost never do and it was on asphalt never the less and it was face down. The screen protector saved the day and I saw many dents and cracks but none to my actual screen. So happy with this product. I did get nervous and buy an otterbox case now.,5,1,2019-3-31,1,1,1
item arrived the day before the iphone max launch .good price for the product easy to apply no bobbles no rainbow effect so far so good,5,1,2018-9-24,1,1,1
Clear and strong coverLove to buy it again,5,1,2019-10-22,1,9,0
"This is the BEST screen protector EVER!!!!  Here’s why::  I was getting ready to leave a friends house late one night and a bee flew into my car. Ugh, I hate bees, I’m scared of bees, but my friend said she would get it out. She asked to use the flashlight on my phone so she could see it better. Sure, so I turned on the flashlight and gave it to her. After her swatting at the bee several times to get it out of the car, it landed on her hand, the hand she was holding my phone with. All of a sudden, she slams my phone down to the ground and screamed cause she was afraid the bee would sting her. OH NO!! MY PHONE!! It hit the concrete drive and my case broke apart and my phone fell out. My friend started apologizing over and over, but I told her not to worry. I knew she didn’t throw it on purpose, she was just scared. With the bee gone, I got in my car and drove home. Once home, I observed the damage to my phone. It looked like the screen had a crack in it at the top...WAIT! NO! It wasn’t my phone that had the crack, it was the screen protector!!  I WAS SOOOOO HAPPY!!!  I peeled off the screen protector, and could see it was cracked, but MY PHONE WAS PERFECT! NOT A SCRATCH ON IT!!  Sooo glad this package comes with 3 protectors in it. I put a new one on my phone and it’s perfect!  And my phone case? My phone case is still perfect as well. It did open and my phone did come out, but my phone is SAFE! And my phone case has NO BREAKS!Thank you thank you thank you for making such a great protector for my phone!!",5,1,2019-7-20,1,7,1
"It is a good deal to have 3 packs glass protectors under $7. You have all you needs to install the protector. it is easy but you have to carefully put down glass protector in the right position. Don’t try to pull it up by nail or you will break it. It is not strong as you think. Honestly, it is a fair price.",5,1,2019-1-29,1,5,1
"I recently bought an iPhone XS and two weeks later, this happens! If it was not for this screen protector, I would have severely damaged this phone and be out of pocket of $200.00 😩 I would definitely recommend this product and will be investing some more because this phone cost. Paying this price, as oppose to $200.00 replacement screen is a no brainer!",5,1,2019-1-5,1,5,1
"Good quality and easy instructions available to use the screen protector . Even if u use a case for ur xs max there is a small gap in all sides of the screen protector to the walls of the phone . Can view them in my photos too. If u didn’t fix the glass correctly , while using the phone it may look odd with sideways ( glass alignment to screen).",3,1,2019-1-4,1,3,1
"I’ve bought protectors from this brand before and I like it but this last one that I bought for the iPhone XS Max is not very good quality, I have been using it for 3 days and it’s already breaking. I haven’t even dropped the phone once..... it broke on the side and on the bottom right corner just from putting it on my pocket and carrying around, literally took it out of my pocket and it had broken, I did not sit or anything, you can just tell the quality of this one isn’t just bad (I also have a very good case that protects the screen and is way more raised than the screen protector) At least it’s a 3 pack but 3 days in I’m already using the second one when before they use to last me for months maybe even a year without being this broken. Very disappointed",2,1,2018-9-24,1,2,0
Hate it cutting my losses on this & buying another brand.Doesn’t cover both edges of my iPhone XS Max screen.,1,1,2020-1-4,1,1,0
This screen protector will likely protect your phone if it's the only one you have. It does not come with an installation frame and I didn't realize that when I bought it. I installed it and it's a little off and it's driving me crazy so I was going to have to use another one but wanted to give it a week or so to try to get used to it. My touch screen is not working well so that's a big factor in me going with a different screen protector.I have used different screen protection in the past and didn't even know it was there and this one I know is there.I don't like that. If I  hadn't used one I would have returned it.,2,1,2019-10-13,1,0,0
"This is a great protector for the cost!I have used many other screen protectors around this price range and this one is probably the best. Other ones around this price typically have what is known as a 'halo effect', but in my experience, none of the three had that.",5,1,2019-4-27,1,0,0
Screen is not as responsive with this screen protector on. Also doesn't cover the entire screen. I've had multiple screen protectors in the past the worked very well for me but they were just a little bit more expensive. I thought I'd give this one a shot because it was a little bit less than others but I would just avoid this specific one.,1,1,2019-8-14,1,2,0
"I think for the cost and how I treat my device, this product is perfect. It came with three screens, stickies for dust, wet wipe, and dry wipe. Since application, I have dropped my phone one time and it has stayed intact and hasn't even cracked yet. Considering my phone fell face down, that is impressive to me.I will say, I worked in the cell phone industry for 5+ years and had plenty of experience with applying these types of screen protectors. With that, it was easy for me HOWEVER, If you have not had that experience I wouldn't recommend putting this on without some cellular rep assistance. Since it doesn't come with a mold for you to have easier application you can have bubbles or of setting of the protector.",4,1,2019-12-16,1,0,0
"The screen protector is just too small for the screen and does not provide adequate coverage at the edges. The description upfront does not mention anything about it. In the FAQs it does mention that this does not provide full coverage. However, that is no excuse for how small this is. More often then not, screens crack at the edge. If a screen protector does not come up to the flat edge of a screen, it cannot really provide protection against impact.",1,1,2019-10-13,1,2,0
